,,False,VRdad,,,,[],,,,text,t2_pbfjc,,,False,False,,False,,False,1535357508.0,1535328708.0,,,,self.boardgames,0,False,0,False,False,9akbdo,False,False,False,False,True,False,,,,[],,,dark,text,False,,{},False,,,,[],t3_9akbdo,True,7,0,,False,all_ads,/r/boardgames/comments/9akbdo/conan_boardgame_expansion_advice/,False,,,6,False,,,False,7,,{},I have the Conan Boardgame and I am seeking advice on what expansion was the best. If you played them what do you think? ,"&lt;!-- SC_OFF --&gt;&lt;div class=""md""&gt;&lt;p&gt;I have the Conan Boardgame and I am seeking advice on what expansion was the best. If you played them what do you think? &lt;/p&gt;
&lt;/div&gt;&lt;!-- SC_ON --&gt;",True,False,False,boardgames,t5_2qmjp,r/boardgames,887577,public,,self,,,Conan Boardgame Expansion Advice,7,https://www.reddit.com/r/boardgames/comments/9akbdo/conan_boardgame_expansion_advice/,[],,False,all_ads,6
,,False,IcySnow92,,,,[],,,,text,t2_dhj5ece,,,False,False,,False,,False,1535358336.0,1535329536.0,,,,self.boardgames,0,1535334160.0,0,False,False,9akeuw,False,False,False,False,True,False,,,,[],,,dark,text,False,,{},False,,,,[],t3_9akeuw,False,31,0,,False,all_ads,/r/boardgames/comments/9akeuw/when_introducing_a_heavy_game_to_my_friends_how/,False,,,6,False,,,False,7,,{},"I recently tried out Blood Rage and Terraforming Mars with two different sub-groups on different days, and the first play of each game went like this:

1. I explain the goal of the game, the main concept and how game turns go.
2. I go into more details what kinds of things you can do in a turn, and what to expect.
3. One to two people start yawning because they cannot remember all the stuff mentioned till now, and request that we just do a ""quick try"" and they will ask questions along the way.
4. First game starts, and they do ask questions. However, each of them asks questions for almost everything they see (i.e. for each card effect), and then spends some more time deciding what to do. This process takes a lot of time.
5. If I tell them to hurry up, as I make all my moves in a few seconds, they get annoyed saying I have already known all the rules so I should be patient.
6. As the game goes on, they gradually ""understand"" the game, but still make arbitrary moves because they are are not familiar with the game enough. They still spend a lot of time making decisions which ultimately do not mean much since the play is supposed to be a ""quick try"" before the real play.
7. First play ends, and it takes much longer than anticipated (\~3 hours for Blood Rage, 4.5 - 5 hours for Terraforming Mars).
8. Besides a few gamer friends, most complain ""Let's play something else now since this game takes too long"" and they will spread the incorrect view of these games being ""extremely lengthy"" to other friends.

With one of the sub-group, I insisted that we try Blood Rage one more time with the same number of people, and the second game with this group only took \~60 - 70 minutes, definitely much more in line with general expectation. The other sub-group, however, now think quite badly of Mars and Blood Rage because the first plays were too long for them.

Knowing that these same people really enjoy strategy games when they reach a certain level of proficiency, **how should I organize the first play of relatively heavy games**? I don't want to rush through the first play too quickly since the essence of strategic decision making may be lost. On the other hand, letting them take their time drags the first play for too long, and these same people become bored in the process and do not want to come back for a 2nd try.

It is quite a lengthy post but I hope I have made my question clear enough. Thanks in advance for any input.","&lt;!-- SC_OFF --&gt;&lt;div class=""md""&gt;&lt;p&gt;I recently tried out Blood Rage and Terraforming Mars with two different sub-groups on different days, and the first play of each game went like this:&lt;/p&gt;

&lt;ol&gt;
&lt;li&gt;I explain the goal of the game, the main concept and how game turns go.&lt;/li&gt;
&lt;li&gt;I go into more details what kinds of things you can do in a turn, and what to expect.&lt;/li&gt;
&lt;li&gt;One to two people start yawning because they cannot remember all the stuff mentioned till now, and request that we just do a &amp;quot;quick try&amp;quot; and they will ask questions along the way.&lt;/li&gt;
&lt;li&gt;First game starts, and they do ask questions. However, each of them asks questions for almost everything they see (i.e. for each card effect), and then spends some more time deciding what to do. This process takes a lot of time.&lt;/li&gt;
&lt;li&gt;If I tell them to hurry up, as I make all my moves in a few seconds, they get annoyed saying I have already known all the rules so I should be patient.&lt;/li&gt;
&lt;li&gt;As the game goes on, they gradually &amp;quot;understand&amp;quot; the game, but still make arbitrary moves because they are are not familiar with the game enough. They still spend a lot of time making decisions which ultimately do not mean much since the play is supposed to be a &amp;quot;quick try&amp;quot; before the real play.&lt;/li&gt;
&lt;li&gt;First play ends, and it takes much longer than anticipated (~3 hours for Blood Rage, 4.5 - 5 hours for Terraforming Mars).&lt;/li&gt;
&lt;li&gt;Besides a few gamer friends, most complain &amp;quot;Let&amp;#39;s play something else now since this game takes too long&amp;quot; and they will spread the incorrect view of these games being &amp;quot;extremely lengthy&amp;quot; to other friends.&lt;/li&gt;
&lt;/ol&gt;

&lt;p&gt;With one of the sub-group, I insisted that we try Blood Rage one more time with the same number of people, and the second game with this group only took ~60 - 70 minutes, definitely much more in line with general expectation. The other sub-group, however, now think quite badly of Mars and Blood Rage because the first plays were too long for them.&lt;/p&gt;

&lt;p&gt;Knowing that these same people really enjoy strategy games when they reach a certain level of proficiency, &lt;strong&gt;how should I organize the first play of relatively heavy games&lt;/strong&gt;? I don&amp;#39;t want to rush through the first play too quickly since the essence of strategic decision making may be lost. On the other hand, letting them take their time drags the first play for too long, and these same people become bored in the process and do not want to come back for a 2nd try.&lt;/p&gt;

&lt;p&gt;It is quite a lengthy post but I hope I have made my question clear enough. Thanks in advance for any input.&lt;/p&gt;
&lt;/div&gt;&lt;!-- SC_ON --&gt;",True,False,False,boardgames,t5_2qmjp,r/boardgames,887578,public,,self,,,"When introducing a heavy game to my friends, how should I reduce the length of the 1st play?",7,https://www.reddit.com/r/boardgames/comments/9akeuw/when_introducing_a_heavy_game_to_my_friends_how/,[],,False,all_ads,6
,,False,dogscantwhistle,,,,[],,,,text,t2_16vaxv,,,False,False,,False,,False,1535413655.0,1535384855.0,,,,self.boardgames,0,False,0,False,False,9aq28g,False,False,False,False,True,False,,,,[],,,dark,text,False,,{},False,,,,[],t3_9aq28g,True,0,0,,False,all_ads,/r/boardgames/comments/9aq28g/has_anyone_ordered_from_kanga_games_in_taiwan/,False,,,6,False,,,False,0,,{},I’d like to get a copy of Duck Duck Bruce and it’s out of print in the U.S. Does anyone have experience ordering from this publisher? ,"&lt;!-- SC_OFF --&gt;&lt;div class=""md""&gt;&lt;p&gt;I’d like to get a copy of Duck Duck Bruce and it’s out of print in the U.S. Does anyone have experience ordering from this publisher? &lt;/p&gt;
&lt;/div&gt;&lt;!-- SC_ON --&gt;",True,False,False,boardgames,t5_2qmjp,r/boardgames,887578,public,,self,,,Has anyone ordered from Kanga Games in Taiwan?,0,https://www.reddit.com/r/boardgames/comments/9aq28g/has_anyone_ordered_from_kanga_games_in_taiwan/,[],,False,all_ads,6
,,False,Ryodu,,,,[],,,,text,t2_5lw68,,,False,False,,False,,False,1535363802.0,1535335002.0,,,,self.boardgames,0,False,0,False,False,9al19s,False,False,False,False,True,False,,,,[],,,dark,text,False,,{},False,,,,[],t3_9al19s,False,5,0,,False,all_ads,/r/boardgames/comments/9al19s/world_of_warcraft_tcg_looking_to_buy_need_help/,False,,,6,False,,,False,5,,{},"A long while ago I picked up a bunch of WoW TCG cards for $5. The cards, if I remember correctly, weren't much but it did come with the Molten Core Raid Deck.  
  
Anyway, fast forward to now and I've been looking at getting some more co-op games. My friends and I used to play WoW (the video game) a TON back in the day and I thought picking up the raid and dungeon decks might be a fun nostalgic trip.  
  
It's a little daunting seeing all the sealed product out there. If anyone can help, I'd be happy to hear what Raid decks I should get, if the starter decks/ champion decks are good, or if I should pre-build some decks using singles.

Thanks!","&lt;!-- SC_OFF --&gt;&lt;div class=""md""&gt;&lt;p&gt;A long while ago I picked up a bunch of WoW TCG cards for $5. The cards, if I remember correctly, weren&amp;#39;t much but it did come with the Molten Core Raid Deck.  &lt;/p&gt;

&lt;p&gt;Anyway, fast forward to now and I&amp;#39;ve been looking at getting some more co-op games. My friends and I used to play WoW (the video game) a TON back in the day and I thought picking up the raid and dungeon decks might be a fun nostalgic trip.  &lt;/p&gt;

&lt;p&gt;It&amp;#39;s a little daunting seeing all the sealed product out there. If anyone can help, I&amp;#39;d be happy to hear what Raid decks I should get, if the starter decks/ champion decks are good, or if I should pre-build some decks using singles.&lt;/p&gt;

&lt;p&gt;Thanks!&lt;/p&gt;
&lt;/div&gt;&lt;!-- SC_ON --&gt;",True,False,False,boardgames,t5_2qmjp,r/boardgames,887578,public,,self,,,"World of Warcraft TCG - Looking to buy, need help!",5,https://www.reddit.com/r/boardgames/comments/9al19s/world_of_warcraft_tcg_looking_to_buy_need_help/,[],,False,all_ads,6
,,False,pFe1FF,,,scythe,"[{'e': 'text', 't': 'Scythe'}]",84ef22e4-18ab-11e7-93c4-0ed78322c06a,Scythe,dark,richtext,t2_snchy,,,False,False,,False,,False,1535359535.0,1535330735.0,,,,self.boardgames,0,1535379246.0,0,False,False,9akjtc,False,False,False,False,True,False,,,,[],,,dark,text,False,,{},False,,,,[],t3_9akjtc,False,52,0,,False,all_ads,/r/boardgames/comments/9akjtc/boardgames_with_app_yes_or_no/,False,,,6,False,,,False,2,,{},"For a project I searching about apps in boardgames.

Do you like Boardgames with assistant apps or do you think everything have to be analog.

Do you know some boardgames, that have good apps? 

and what do you want, that a boardgame assistant app can do?
 for example: just timer (if necessary), setup description, Solo variant... ?


Some boardgames with app I know are EXIT, where the App descriped the setup and make sound while the timer is running, and Clue DVD (not directly an app, but game assistant), where the butler, gives hints from time to time, if you playing a scenario.


EDIT: Thanks for the commends so far, it's really interesting to read them :)","&lt;!-- SC_OFF --&gt;&lt;div class=""md""&gt;&lt;p&gt;For a project I searching about apps in boardgames.&lt;/p&gt;

&lt;p&gt;Do you like Boardgames with assistant apps or do you think everything have to be analog.&lt;/p&gt;

&lt;p&gt;Do you know some boardgames, that have good apps? &lt;/p&gt;

&lt;p&gt;and what do you want, that a boardgame assistant app can do?
 for example: just timer (if necessary), setup description, Solo variant... ?&lt;/p&gt;

&lt;p&gt;Some boardgames with app I know are EXIT, where the App descriped the setup and make sound while the timer is running, and Clue DVD (not directly an app, but game assistant), where the butler, gives hints from time to time, if you playing a scenario.&lt;/p&gt;

&lt;p&gt;EDIT: Thanks for the commends so far, it&amp;#39;s really interesting to read them :)&lt;/p&gt;
&lt;/div&gt;&lt;!-- SC_ON --&gt;",True,False,False,boardgames,t5_2qmjp,r/boardgames,887578,public,,self,,,Boardgames with App. Yes or no?,2,https://www.reddit.com/r/boardgames/comments/9akjtc/boardgames_with_app_yes_or_no/,[],,False,all_ads,6
,,False,DaJMeRos,,,,[],,,,text,t2_1ymgl327,,,False,False,,False,,False,1535402429.0,1535373629.0,,,,self.boardgames,0,False,0,False,False,9aol4w,False,False,False,False,True,False,,,,[],,,dark,text,False,,{},False,,,,[],t3_9aol4w,True,6,0,,False,all_ads,/r/boardgames/comments/9aol4w/boardgame_creation_theory/,False,,,6,False,,,False,0,,{},"Hey guys ^^. I'm of the creative kind and I am always coming up with new boardgame ideas. I wanted to ask, do you recommend or know of any books or webpages with boardgame development guides, theory or tutorials? Thanks guys! Keep playing! ","&lt;!-- SC_OFF --&gt;&lt;div class=""md""&gt;&lt;p&gt;Hey guys &lt;sup&gt;&lt;sup&gt;.&lt;/sup&gt;&lt;/sup&gt; I&amp;#39;m of the creative kind and I am always coming up with new boardgame ideas. I wanted to ask, do you recommend or know of any books or webpages with boardgame development guides, theory or tutorials? Thanks guys! Keep playing! &lt;/p&gt;
&lt;/div&gt;&lt;!-- SC_ON --&gt;",True,False,False,boardgames,t5_2qmjp,r/boardgames,887578,public,,self,,,Boardgame creation theory,0,https://www.reddit.com/r/boardgames/comments/9aol4w/boardgame_creation_theory/,[],,False,all_ads,6
,,False,robotco,,,star-trek-fleet-captains,"[{'e': 'text', 't': 'stable wormholes'}]",,stable wormholes,dark,richtext,t2_5pxre,,,False,False,,False,,False,1535379470.0,1535350670.0,,,,self.boardgames,0,False,0,False,False,9amlpt,False,False,False,False,True,False,,,,[],,,dark,text,False,,{},False,,,,[],t3_9amlpt,True,2,0,,False,all_ads,/r/boardgames/comments/9amlpt/does_anyone_have_a_scan_of_the_root_walkthrough/,False,,,6,False,,,False,0,,{},"trying to learn the game for a play this coming weekend. the Learn to Play guide mentions a walkthrough sheet, but i can't find a copy anywhere","&lt;!-- SC_OFF --&gt;&lt;div class=""md""&gt;&lt;p&gt;trying to learn the game for a play this coming weekend. the Learn to Play guide mentions a walkthrough sheet, but i can&amp;#39;t find a copy anywhere&lt;/p&gt;
&lt;/div&gt;&lt;!-- SC_ON --&gt;",True,False,False,boardgames,t5_2qmjp,r/boardgames,887578,public,,self,,,does anyone have a scan of the Root Walkthrough Sheet?,0,https://www.reddit.com/r/boardgames/comments/9amlpt/does_anyone_have_a_scan_of_the_root_walkthrough/,[],,False,all_ads,6
,,False,jklick,,,,[],,,,text,t2_8ys9h,,,False,False,,False,,False,1535405547.0,1535376747.0,,,,gamestop.com,0,False,0,False,False,9aoyd5,False,False,False,False,False,False,,,deal,"[{'e': 'text', 't': 'Deal'}]",a5cb0ebe-638d-11e3-aa0f-12313b04ceaf,Deal,dark,richtext,False,,{},False,,,,[],t3_9aoyd5,True,16,0,,False,all_ads,/r/boardgames/comments/9aoyd5/50_off_a_large_amount_of_tabletop_games_at/,False,,,6,False,,,False,0,,{},,,True,False,False,boardgames,t5_2qmjp,r/boardgames,887578,public,,default,,,50% off a large amount of tabletop games at GameStop,0,"https://www.gamestop.com/browse/card-board-games?nav=16k-3-clearance,28zu0,139a-162",[],,False,all_ads,6
,,False,Eraser18574,,,,[],,,,text,t2_10r90y,,,False,False,,False,,False,1535377806.0,1535349006.0,,,,self.boardgames,0,False,0,False,False,9amgla,False,False,False,False,True,False,,,rules,"[{'e': 'text', 't': 'Rules'}]",e048502e-709a-11e7-9f79-0e36a8135aee,Rules,dark,richtext,False,,{},False,,,,[],t3_9amgla,True,21,0,,False,all_ads,/r/boardgames/comments/9amgla/time_stories_question/,False,,,6,False,,,False,2,,{},"So my wife and I started Time Stories and we finished the first scenario after a few tries. 

Now we are stuck on Marcy‘s Case and after a few runs without having the feeling of advancing very far and the problem that we can’t play that regularly to remember all the little details we started to make notes.

My wife asked me if that was allowed, she thought it comes close to cheating, but we really want to get through the scenario, since it’s not really clicking that much with us. There are just to many fights. So we took notes.

I wondered how you guys think about taking notes playing this game. Do you do it? Or do you think it’s cheating.","&lt;!-- SC_OFF --&gt;&lt;div class=""md""&gt;&lt;p&gt;So my wife and I started Time Stories and we finished the first scenario after a few tries. &lt;/p&gt;

&lt;p&gt;Now we are stuck on Marcy‘s Case and after a few runs without having the feeling of advancing very far and the problem that we can’t play that regularly to remember all the little details we started to make notes.&lt;/p&gt;

&lt;p&gt;My wife asked me if that was allowed, she thought it comes close to cheating, but we really want to get through the scenario, since it’s not really clicking that much with us. There are just to many fights. So we took notes.&lt;/p&gt;

&lt;p&gt;I wondered how you guys think about taking notes playing this game. Do you do it? Or do you think it’s cheating.&lt;/p&gt;
&lt;/div&gt;&lt;!-- SC_ON --&gt;",True,False,False,boardgames,t5_2qmjp,r/boardgames,887578,public,,self,,,T.I.M.E Stories Question,2,https://www.reddit.com/r/boardgames/comments/9amgla/time_stories_question/,[],,False,all_ads,6
,,False,florzed,,,,[],,,,text,t2_1uzrgl5y,,,False,False,,False,,False,1535342560.0,1535313760.0,,,,self.boardgames,0,False,0,False,False,9aiibl,False,False,False,False,True,False,,,,[],,,dark,text,False,,{},False,,,,[],t3_9aiibl,False,25,0,,False,all_ads,/r/boardgames/comments/9aiibl/background_music_for_board_games/,False,self,"{'images': [{'source': {'url': 'https://i.redditmedia.com/RObwrIsFm1BiTLOaToyOQTLQgzKF5uFkjKPknXJQuj8.jpg?s=819755d46cdfe7d5e9b18c75a15670b6', 'width': 480, 'height': 360}, 'resolutions': [{'url': 'https://i.redditmedia.com/RObwrIsFm1BiTLOaToyOQTLQgzKF5uFkjKPknXJQuj8.jpg?fit=crop&amp;crop=faces%2Centropy&amp;arh=2&amp;w=108&amp;s=1a1309349f398e4d59d15965cdab3d1f', 'width': 108, 'height': 81}, {'url': 'https://i.redditmedia.com/RObwrIsFm1BiTLOaToyOQTLQgzKF5uFkjKPknXJQuj8.jpg?fit=crop&amp;crop=faces%2Centropy&amp;arh=2&amp;w=216&amp;s=f95102455862cb4f91b5e944278ffdff', 'width': 216, 'height': 162}, {'url': 'https://i.redditmedia.com/RObwrIsFm1BiTLOaToyOQTLQgzKF5uFkjKPknXJQuj8.jpg?fit=crop&amp;crop=faces%2Centropy&amp;arh=2&amp;w=320&amp;s=b49ac26f19970287d77ee63b2d1176af', 'width': 320, 'height': 240}], 'variants': {}, 'id': 'tZjx-KpPsFnGbfqapNDe38_lFi_NVvY0GvK61cvQxzM'}], 'enabled': False}",6,False,,,False,5,,{},"So I'd been really looking forward to playing Spirit Island with my boyfriend - we've both been reasonably busy and haven't got to play often, so I was pretty hyped and wanted to make it a bit special, like a bit of a date night in. One of the things i did was set up on my laptop some atmospheric music and island visuals for the background - this exact video if anyone's interested https://youtu.be/-kCNTcyyvNA

And it was so fun! My boyfriend laughed at me a bit but it did add atmosphere. Now I just need to find a suitably spooky accompaniment to Eldritch Horror for our next session...

Does anyone have any good soundtracks/videos they like to pair with games?","&lt;!-- SC_OFF --&gt;&lt;div class=""md""&gt;&lt;p&gt;So I&amp;#39;d been really looking forward to playing Spirit Island with my boyfriend - we&amp;#39;ve both been reasonably busy and haven&amp;#39;t got to play often, so I was pretty hyped and wanted to make it a bit special, like a bit of a date night in. One of the things i did was set up on my laptop some atmospheric music and island visuals for the background - this exact video if anyone&amp;#39;s interested &lt;a href=""https://youtu.be/-kCNTcyyvNA""&gt;https://youtu.be/-kCNTcyyvNA&lt;/a&gt;&lt;/p&gt;

&lt;p&gt;And it was so fun! My boyfriend laughed at me a bit but it did add atmosphere. Now I just need to find a suitably spooky accompaniment to Eldritch Horror for our next session...&lt;/p&gt;

&lt;p&gt;Does anyone have any good soundtracks/videos they like to pair with games?&lt;/p&gt;
&lt;/div&gt;&lt;!-- SC_ON --&gt;",True,False,False,boardgames,t5_2qmjp,r/boardgames,887578,public,,self,,,Background music for board games?,5,https://www.reddit.com/r/boardgames/comments/9aiibl/background_music_for_board_games/,[],,False,all_ads,6
,,False,Clockworkedd,,,,[],,,,text,t2_1vukknk2,,,False,False,,False,,False,1535390815.0,1535362015.0,,,,self.boardgames,0,False,0,False,False,9anhc4,False,False,False,False,True,False,,,,[],,,dark,text,False,,{},False,,,,[],t3_9anhc4,True,9,0,,False,all_ads,/r/boardgames/comments/9anhc4/is_spellcaster_balanced/,False,,,6,False,,,False,0,,{},"I recently got Spellcaster, and wanted to play it with two of my other friends. Soon after we started, one of them complained that they couldn’t show his teammate his cards, claiming it gives the solo player a blatant advantage. Is he correct, or is he just cranky?","&lt;!-- SC_OFF --&gt;&lt;div class=""md""&gt;&lt;p&gt;I recently got Spellcaster, and wanted to play it with two of my other friends. Soon after we started, one of them complained that they couldn’t show his teammate his cards, claiming it gives the solo player a blatant advantage. Is he correct, or is he just cranky?&lt;/p&gt;
&lt;/div&gt;&lt;!-- SC_ON --&gt;",True,False,False,boardgames,t5_2qmjp,r/boardgames,887578,public,,self,,,Is Spellcaster Balanced?,0,https://www.reddit.com/r/boardgames/comments/9anhc4/is_spellcaster_balanced/,[],,False,all_ads,6
,,False,matty348,,,battlestar-galactica,"[{'e': 'text', 't': 'Battlestar Galactica'}]",,Battlestar Galactica,dark,richtext,t2_4gocl,,,False,False,,False,,False,1535374410.0,1535345610.0,,,,self.boardgames,0,False,0,False,False,9am5ip,False,False,False,False,True,False,,,,[],,,dark,text,False,,{},False,,,,[],t3_9am5ip,False,5,0,,False,all_ads,/r/boardgames/comments/9am5ip/going_to_pax_prime_next_weekend_anyone_know_what/,False,,,6,False,,,False,4,,{},I always like seeing thew new crop of games when I make my way to a convention. I was wondering if anyone knows of some upcoming or recently kickstarted games that will have demos available at PAX.,"&lt;!-- SC_OFF --&gt;&lt;div class=""md""&gt;&lt;p&gt;I always like seeing thew new crop of games when I make my way to a convention. I was wondering if anyone knows of some upcoming or recently kickstarted games that will have demos available at PAX.&lt;/p&gt;
&lt;/div&gt;&lt;!-- SC_ON --&gt;",True,False,False,boardgames,t5_2qmjp,r/boardgames,887578,public,,self,,,Going to PAX Prime next weekend. Anyone know what new games will be available for demo there?,4,https://www.reddit.com/r/boardgames/comments/9am5ip/going_to_pax_prime_next_weekend_anyone_know_what/,[],,False,all_ads,6
,,False,ekime187,,,,[],,,,text,t2_ngw9c,,,False,False,,False,,False,1535322574.0,1535293774.0,,,,self.boardgames,0,False,0,False,False,9afwyd,False,False,False,False,True,False,,,,[],,,dark,text,False,,{},False,,,,[],t3_9afwyd,False,9,0,,False,all_ads,/r/boardgames/comments/9afwyd/question_about_what_game_this_is_from/,False,self,"{'images': [{'source': {'url': 'https://i.redditmedia.com/-w6v5fAps_NXnCt79veKbQW9XRvT0-BNqhkiVojphaE.jpg?s=a494260332f42c3107baf1ae3032e3cd', 'width': 4008, 'height': 5344}, 'resolutions': [{'url': 'https://i.redditmedia.com/-w6v5fAps_NXnCt79veKbQW9XRvT0-BNqhkiVojphaE.jpg?fit=crop&amp;crop=faces%2Centropy&amp;arh=2&amp;w=108&amp;s=0989edbbb6c7afd2b0c5c06df090dc2a', 'width': 108, 'height': 144}, {'url': 'https://i.redditmedia.com/-w6v5fAps_NXnCt79veKbQW9XRvT0-BNqhkiVojphaE.jpg?fit=crop&amp;crop=faces%2Centropy&amp;arh=2&amp;w=216&amp;s=4cff9b83eb0f5b25066e8e7eb7c5909a', 'width': 216, 'height': 288}, {'url': 'https://i.redditmedia.com/-w6v5fAps_NXnCt79veKbQW9XRvT0-BNqhkiVojphaE.jpg?fit=crop&amp;crop=faces%2Centropy&amp;arh=2&amp;w=320&amp;s=1cfe409935a426e9bdd39c73e5bd13ea', 'width': 320, 'height': 426}, {'url': 'https://i.redditmedia.com/-w6v5fAps_NXnCt79veKbQW9XRvT0-BNqhkiVojphaE.jpg?fit=crop&amp;crop=faces%2Centropy&amp;arh=2&amp;w=640&amp;s=5d5c00081d573c95fa3d0eaafeaae0db', 'width': 640, 'height': 853}, {'url': 'https://i.redditmedia.com/-w6v5fAps_NXnCt79veKbQW9XRvT0-BNqhkiVojphaE.jpg?fit=crop&amp;crop=faces%2Centropy&amp;arh=2&amp;w=960&amp;s=6b644c6863d4acae9002e5a78fd13ea6', 'width': 960, 'height': 1280}, {'url': 'https://i.redditmedia.com/-w6v5fAps_NXnCt79veKbQW9XRvT0-BNqhkiVojphaE.jpg?fit=crop&amp;crop=faces%2Centropy&amp;arh=2&amp;w=1080&amp;s=d32394fe2c122818a3486695521e8b1f', 'width': 1080, 'height': 1440}], 'variants': {}, 'id': 'cz6_Wh1KBE5ptHHxtxtMpBaeM03oZBl-MkAcQLWw02g'}], 'enabled': False}",6,False,,,False,12,,{},"Can anyone identify this card? I received it at gencon and can't remember what game it came from.

https://imgur.com/a/Fr8kbbP","&lt;!-- SC_OFF --&gt;&lt;div class=""md""&gt;&lt;p&gt;Can anyone identify this card? I received it at gencon and can&amp;#39;t remember what game it came from.&lt;/p&gt;

&lt;p&gt;&lt;a href=""https://imgur.com/a/Fr8kbbP""&gt;https://imgur.com/a/Fr8kbbP&lt;/a&gt;&lt;/p&gt;
&lt;/div&gt;&lt;!-- SC_ON --&gt;",True,False,False,boardgames,t5_2qmjp,r/boardgames,887578,public,,self,,,Question about what game this is from,12,https://www.reddit.com/r/boardgames/comments/9afwyd/question_about_what_game_this_is_from/,[],,False,all_ads,6
