,,False,foreigneternity,,,descent,"[{'e': 'text', 't': 'Descent 1E Forever!'}]",,Descent 1E Forever!,dark,richtext,t2_csnce,,,False,False,,False,,False,1535159731.0,1535130931.0,,,,self.boardgames,0,False,0,False,False,99za8f,False,False,False,False,True,False,,,,[],,,dark,text,False,,{},False,,,,[],t3_99za8f,False,18,0,,False,all_ads,/r/boardgames/comments/99za8f/if_youre_looking_to_pimp_out_your_copy_of_war_of/,False,self,"{'images': [{'source': {'url': 'https://i.redditmedia.com/ph7-BpeuqAt1M30JjrwDefbasGb9AbmOQWcXsmh9r4A.jpg?s=bc793bac47000d00d5dcad5b4fed628c', 'width': 3024, 'height': 4032}, 'resolutions': [{'url': 'https://i.redditmedia.com/ph7-BpeuqAt1M30JjrwDefbasGb9AbmOQWcXsmh9r4A.jpg?fit=crop&amp;crop=faces%2Centropy&amp;arh=2&amp;w=108&amp;s=cbd4d5b0a4444c20695719989ca4a224', 'width': 108, 'height': 144}, {'url': 'https://i.redditmedia.com/ph7-BpeuqAt1M30JjrwDefbasGb9AbmOQWcXsmh9r4A.jpg?fit=crop&amp;crop=faces%2Centropy&amp;arh=2&amp;w=216&amp;s=8cedb48759019c3903731ab7f85e2bd2', 'width': 216, 'height': 288}, {'url': 'https://i.redditmedia.com/ph7-BpeuqAt1M30JjrwDefbasGb9AbmOQWcXsmh9r4A.jpg?fit=crop&amp;crop=faces%2Centropy&amp;arh=2&amp;w=320&amp;s=63f52f1f9074e9e6dfe3f20cd32f80c9', 'width': 320, 'height': 426}, {'url': 'https://i.redditmedia.com/ph7-BpeuqAt1M30JjrwDefbasGb9AbmOQWcXsmh9r4A.jpg?fit=crop&amp;crop=faces%2Centropy&amp;arh=2&amp;w=640&amp;s=5f660c4d0917c6c7d82525495fe81c17', 'width': 640, 'height': 853}, {'url': 'https://i.redditmedia.com/ph7-BpeuqAt1M30JjrwDefbasGb9AbmOQWcXsmh9r4A.jpg?fit=crop&amp;crop=faces%2Centropy&amp;arh=2&amp;w=960&amp;s=65995c01b525744d17545ba4b0771c79', 'width': 960, 'height': 1280}, {'url': 'https://i.redditmedia.com/ph7-BpeuqAt1M30JjrwDefbasGb9AbmOQWcXsmh9r4A.jpg?fit=crop&amp;crop=faces%2Centropy&amp;arh=2&amp;w=1080&amp;s=9a7b62c27976d60bd28866d34f5cd8a8', 'width': 1080, 'height': 1440}], 'variants': {}, 'id': 'iGuk5IeRl0a1o0vYhAv8f_fKg6PdCTL1j2etAyaq-7U'}], 'enabled': False}",6,False,,,False,30,,{},"This is especially for owners of anniversary or collectors editions, but also for 1st and 2nd edition owners who don't mind a more crowded board:

1. Buy authentic rings. You can get copies of the One Ring and the 3 Elven Rings on ebay for dirt cheap.

2. Buy strongholds. I recently got [mine](https://imgur.com/gallery/67qy6Xs) from Dreamspirit Wargaming Studio, but there are people on BGG like sickdave and fubar who make them as well. Some sellers on etsy make 3D printed ones. These will cost you anywhere from $50-300 dollars depending on from whom you buy them.

3. Mountain ranges. Right now the only person I know of who makes the mountain ranges is sickdave on BGG. He's currently taking orders. Not sure how well they'll fit on regular edition boards.

4. Army markers. I've seen some of these on BGG and other places where people custom make these. I think they might be a tad excessive.

5. Custom battle dice. If War of the Ring has one fault (especially the anniversary/collectors editions) it's the boring battle dice. Pimp out your games with some special versions of these.

Any other ideas or things you've seen that are pretty worthwhile?","&lt;!-- SC_OFF --&gt;&lt;div class=""md""&gt;&lt;p&gt;This is especially for owners of anniversary or collectors editions, but also for 1st and 2nd edition owners who don&amp;#39;t mind a more crowded board:&lt;/p&gt;

&lt;ol&gt;
&lt;li&gt;&lt;p&gt;Buy authentic rings. You can get copies of the One Ring and the 3 Elven Rings on ebay for dirt cheap.&lt;/p&gt;&lt;/li&gt;
&lt;li&gt;&lt;p&gt;Buy strongholds. I recently got &lt;a href=""https://imgur.com/gallery/67qy6Xs""&gt;mine&lt;/a&gt; from Dreamspirit Wargaming Studio, but there are people on BGG like sickdave and fubar who make them as well. Some sellers on etsy make 3D printed ones. These will cost you anywhere from $50-300 dollars depending on from whom you buy them.&lt;/p&gt;&lt;/li&gt;
&lt;li&gt;&lt;p&gt;Mountain ranges. Right now the only person I know of who makes the mountain ranges is sickdave on BGG. He&amp;#39;s currently taking orders. Not sure how well they&amp;#39;ll fit on regular edition boards.&lt;/p&gt;&lt;/li&gt;
&lt;li&gt;&lt;p&gt;Army markers. I&amp;#39;ve seen some of these on BGG and other places where people custom make these. I think they might be a tad excessive.&lt;/p&gt;&lt;/li&gt;
&lt;li&gt;&lt;p&gt;Custom battle dice. If War of the Ring has one fault (especially the anniversary/collectors editions) it&amp;#39;s the boring battle dice. Pimp out your games with some special versions of these.&lt;/p&gt;&lt;/li&gt;
&lt;/ol&gt;

&lt;p&gt;Any other ideas or things you&amp;#39;ve seen that are pretty worthwhile?&lt;/p&gt;
&lt;/div&gt;&lt;!-- SC_ON --&gt;",True,False,False,boardgames,t5_2qmjp,r/boardgames,887577,public,,self,,,"If you're looking to pimp out your copy of War of the Ring, here are 5 suggestions:",30,https://www.reddit.com/r/boardgames/comments/99za8f/if_youre_looking_to_pimp_out_your_copy_of_war_of/,[],,False,all_ads,6
,,False,eerie343,,,,[],,,,text,t2_16xhlq,,,False,False,,False,,False,1535205212.0,1535176412.0,,,,self.boardgames,0,False,0,False,False,9a4nd7,False,False,False,False,True,False,,,,[],,,dark,text,False,,{},False,,,,[],t3_9a4nd7,False,6,0,,False,all_ads,/r/boardgames/comments/9a4nd7/how_to_make_pandemic_cards/,False,self,"{'images': [{'source': {'url': 'https://i.redditmedia.com/ySic7mwBbSQmaeRNK24T4OszWyg9RytyalA5schcP28.jpg?s=377d70255321fa4ed22387d0f0a924ac', 'width': 780, 'height': 1080}, 'resolutions': [{'url': 'https://i.redditmedia.com/ySic7mwBbSQmaeRNK24T4OszWyg9RytyalA5schcP28.jpg?fit=crop&amp;crop=faces%2Centropy&amp;arh=2&amp;w=108&amp;s=f4f070caafd76c89e2e5d1524a73b231', 'width': 108, 'height': 149}, {'url': 'https://i.redditmedia.com/ySic7mwBbSQmaeRNK24T4OszWyg9RytyalA5schcP28.jpg?fit=crop&amp;crop=faces%2Centropy&amp;arh=2&amp;w=216&amp;s=59a7874d5a98a30d24ff29001033fb04', 'width': 216, 'height': 299}, {'url': 'https://i.redditmedia.com/ySic7mwBbSQmaeRNK24T4OszWyg9RytyalA5schcP28.jpg?fit=crop&amp;crop=faces%2Centropy&amp;arh=2&amp;w=320&amp;s=a2e9558daf9277dd3c002d0f68617b1c', 'width': 320, 'height': 443}, {'url': 'https://i.redditmedia.com/ySic7mwBbSQmaeRNK24T4OszWyg9RytyalA5schcP28.jpg?fit=crop&amp;crop=faces%2Centropy&amp;arh=2&amp;w=640&amp;s=06b71ddcd3a48e685a6c089d7754caa9', 'width': 640, 'height': 886}], 'variants': {}, 'id': '6YnLEQ9Y2XTqiWovOJkEGxjn8wzYE8id0pn5weoECrc'}], 'enabled': False}",6,False,,,False,2,,{},"Hi, I was wondering if anyone knew how to make custom Pandemic cards. By this I mean how could I create [custom cards like this](https://imgur.com/a/SICOI)?","&lt;!-- SC_OFF --&gt;&lt;div class=""md""&gt;&lt;p&gt;Hi, I was wondering if anyone knew how to make custom Pandemic cards. By this I mean how could I create &lt;a href=""https://imgur.com/a/SICOI""&gt;custom cards like this&lt;/a&gt;?&lt;/p&gt;
&lt;/div&gt;&lt;!-- SC_ON --&gt;",True,False,False,boardgames,t5_2qmjp,r/boardgames,887577,public,,self,,,How to make Pandemic cards?,2,https://www.reddit.com/r/boardgames/comments/9a4nd7/how_to_make_pandemic_cards/,[],,False,all_ads,6
,,False,Dice_and_Dragons,,,,[],,,,text,t2_qakply6,,,False,False,,False,,False,1535143506.0,1535114706.0,,,,youtu.be,0,False,0,False,False,99x3pu,False,False,False,False,False,False,,,,[],,,dark,text,False,"{'oembed': {'provider_url': 'https://www.youtube.com/', 'title': 'Dice and Dragons - Big Trouble in Little China The Game Review', 'type': 'video', 'html': '&lt;iframe width=""600"" height=""338"" src=""https://www.youtube.com/embed/0QKzThW5gSg?feature=oembed&amp;enablejsapi=1"" frameborder=""0"" allow=""autoplay; encrypted-media"" allowfullscreen&gt;&lt;/iframe&gt;', 'author_name': 'Dice and Dragons', 'height': 338, 'width': 600, 'version': '1.0', 'thumbnail_width': 480, 'provider_name': 'YouTube', 'thumbnail_url': 'https://i.ytimg.com/vi/0QKzThW5gSg/hqdefault.jpg', 'thumbnail_height': 360, 'author_url': 'https://www.youtube.com/channel/UCCsWuE13J_UW-Ge1jdxVLew'}, 'type': 'youtube.com'}","{'content': '&lt;iframe width=""600"" height=""338"" src=""https://www.youtube.com/embed/0QKzThW5gSg?feature=oembed&amp;enablejsapi=1"" frameborder=""0"" allow=""autoplay; encrypted-media"" allowfullscreen&gt;&lt;/iframe&gt;', 'width': 600, 'scrolling': False, 'height': 338}",False,,,,[],t3_99x3pu,False,15,0,,False,all_ads,/r/boardgames/comments/99x3pu/dice_and_dragons_big_trouble_in_little_china_the/,False,rich:video,"{'images': [{'source': {'url': 'https://i.redditmedia.com/XEys8mOzfN7pZLj9dNsi6p9T8fvCFfL7FnXZqzFDJfw.jpg?s=3e0c38093774c912b6a83aee6f3ca4f5', 'width': 480, 'height': 360}, 'resolutions': [{'url': 'https://i.redditmedia.com/XEys8mOzfN7pZLj9dNsi6p9T8fvCFfL7FnXZqzFDJfw.jpg?fit=crop&amp;crop=faces%2Centropy&amp;arh=2&amp;w=108&amp;s=2e1cfe7905f5c9b630318fe4e993053e', 'width': 108, 'height': 81}, {'url': 'https://i.redditmedia.com/XEys8mOzfN7pZLj9dNsi6p9T8fvCFfL7FnXZqzFDJfw.jpg?fit=crop&amp;crop=faces%2Centropy&amp;arh=2&amp;w=216&amp;s=e5f5a10d76da8c9376f404a6613d1f30', 'width': 216, 'height': 162}, {'url': 'https://i.redditmedia.com/XEys8mOzfN7pZLj9dNsi6p9T8fvCFfL7FnXZqzFDJfw.jpg?fit=crop&amp;crop=faces%2Centropy&amp;arh=2&amp;w=320&amp;s=a4d045602e1097eb26cc136e55a852fc', 'width': 320, 'height': 240}], 'variants': {}, 'id': '0dupTT9sTqpSpmZa0of6mct3_WJfuES_zaasZYHtNVg'}], 'enabled': False}",6,False,,,False,63,"{'oembed': {'provider_url': 'https://www.youtube.com/', 'title': 'Dice and Dragons - Big Trouble in Little China The Game Review', 'type': 'video', 'html': '&lt;iframe width=""600"" height=""338"" src=""https://www.youtube.com/embed/0QKzThW5gSg?feature=oembed&amp;enablejsapi=1"" frameborder=""0"" allow=""autoplay; encrypted-media"" allowfullscreen&gt;&lt;/iframe&gt;', 'author_name': 'Dice and Dragons', 'height': 338, 'width': 600, 'version': '1.0', 'thumbnail_width': 480, 'provider_name': 'YouTube', 'thumbnail_url': 'https://i.ytimg.com/vi/0QKzThW5gSg/hqdefault.jpg', 'thumbnail_height': 360, 'author_url': 'https://www.youtube.com/channel/UCCsWuE13J_UW-Ge1jdxVLew'}, 'type': 'youtube.com'}","{'content': '&lt;iframe width=""600"" height=""338"" src=""https://www.youtube.com/embed/0QKzThW5gSg?feature=oembed&amp;enablejsapi=1"" frameborder=""0"" allow=""autoplay; encrypted-media"" allowfullscreen&gt;&lt;/iframe&gt;', 'width': 600, 'scrolling': False, 'media_domain_url': 'https://www.redditmedia.com/mediaembed/99x3pu', 'height': 338}",,,True,False,False,boardgames,t5_2qmjp,r/boardgames,887577,public,,https://b.thumbs.redditmedia.com/PJ5svyoy3yud6x4naF-bnDi1Gg0Y-WpRuk5LwZW4mZk.jpg,105.0,140.0,Dice and Dragons - Big Trouble in Little China The Game Review and How To Play,63,https://youtu.be/0QKzThW5gSg,[],,False,all_ads,6
,,False,Superflypete,,,,[],,,,text,t2_negsn,,,False,False,,False,,False,1535165800.0,1535137000.0,,,,youtu.be,0,False,0,False,False,9a04tt,False,False,False,False,False,False,,,review,"[{'e': 'text', 't': 'Review'}]",9beed2b0-4636-11e2-af77-12313b0ce1e2,Review,dark,richtext,False,"{'oembed': {'provider_url': 'https://www.youtube.com/', 'version': '1.0', 'title': 'Hair Brained Games - Seal Team Flix Review', 'author_name': 'Hair Brained Games', 'height': 338, 'width': 600, 'html': '&lt;iframe width=""600"" height=""338"" src=""https://www.youtube.com/embed/7WqCrQfJI0M?feature=oembed&amp;enablejsapi=1"" frameborder=""0"" allow=""autoplay; encrypted-media"" allowfullscreen&gt;&lt;/iframe&gt;', 'thumbnail_width': 480, 'thumbnail_height': 360, 'thumbnail_url': 'https://i.ytimg.com/vi/7WqCrQfJI0M/hqdefault.jpg', 'type': 'video', 'provider_name': 'YouTube', 'author_url': 'https://www.youtube.com/channel/UCjZFKHdm5BJ2LTDHPZ1X96g'}, 'type': 'youtube.com'}","{'content': '&lt;iframe width=""600"" height=""338"" src=""https://www.youtube.com/embed/7WqCrQfJI0M?feature=oembed&amp;enablejsapi=1"" frameborder=""0"" allow=""autoplay; encrypted-media"" allowfullscreen&gt;&lt;/iframe&gt;', 'width': 600, 'scrolling': False, 'height': 338}",False,,,,[],t3_9a04tt,False,2,0,,False,all_ads,/r/boardgames/comments/9a04tt/seal_team_flix_hare_brained_games_review_critical/,False,rich:video,"{'images': [{'source': {'url': 'https://i.redditmedia.com/YMNsBjllubY3ebKwYyHoxQAY1nHQsQTIXfRr9HF_dmc.jpg?s=a0c5b6fbfd3230b773b664aaf4773734', 'width': 480, 'height': 360}, 'resolutions': [{'url': 'https://i.redditmedia.com/YMNsBjllubY3ebKwYyHoxQAY1nHQsQTIXfRr9HF_dmc.jpg?fit=crop&amp;crop=faces%2Centropy&amp;arh=2&amp;w=108&amp;s=d8578c1051da3fb421d666527e188522', 'width': 108, 'height': 81}, {'url': 'https://i.redditmedia.com/YMNsBjllubY3ebKwYyHoxQAY1nHQsQTIXfRr9HF_dmc.jpg?fit=crop&amp;crop=faces%2Centropy&amp;arh=2&amp;w=216&amp;s=5e52ea23fff232a5cb488b27143e15c9', 'width': 216, 'height': 162}, {'url': 'https://i.redditmedia.com/YMNsBjllubY3ebKwYyHoxQAY1nHQsQTIXfRr9HF_dmc.jpg?fit=crop&amp;crop=faces%2Centropy&amp;arh=2&amp;w=320&amp;s=12a44267bea3f07c723d204cceab4f46', 'width': 320, 'height': 240}], 'variants': {}, 'id': 'N14QA8tY-Xd_pnAYoNCbTIDbdMgNxS7soK61J8k1WSY'}], 'enabled': False}",6,False,,,False,19,"{'oembed': {'provider_url': 'https://www.youtube.com/', 'version': '1.0', 'title': 'Hair Brained Games - Seal Team Flix Review', 'author_name': 'Hair Brained Games', 'height': 338, 'width': 600, 'html': '&lt;iframe width=""600"" height=""338"" src=""https://www.youtube.com/embed/7WqCrQfJI0M?feature=oembed&amp;enablejsapi=1"" frameborder=""0"" allow=""autoplay; encrypted-media"" allowfullscreen&gt;&lt;/iframe&gt;', 'thumbnail_width': 480, 'thumbnail_height': 360, 'thumbnail_url': 'https://i.ytimg.com/vi/7WqCrQfJI0M/hqdefault.jpg', 'type': 'video', 'provider_name': 'YouTube', 'author_url': 'https://www.youtube.com/channel/UCjZFKHdm5BJ2LTDHPZ1X96g'}, 'type': 'youtube.com'}","{'content': '&lt;iframe width=""600"" height=""338"" src=""https://www.youtube.com/embed/7WqCrQfJI0M?feature=oembed&amp;enablejsapi=1"" frameborder=""0"" allow=""autoplay; encrypted-media"" allowfullscreen&gt;&lt;/iframe&gt;', 'width': 600, 'scrolling': False, 'media_domain_url': 'https://www.redditmedia.com/mediaembed/9a04tt', 'height': 338}",,,True,False,False,boardgames,t5_2qmjp,r/boardgames,887577,public,,https://b.thumbs.redditmedia.com/7NpeqnHvRzbS-XLYq0UbE4yJojQiZwnLJh63FZQZwOU.jpg,105.0,140.0,SEAL Team Flix: Hare Brained Games Review &amp; Critical Analysis,19,https://youtu.be/7WqCrQfJI0M,[],,False,all_ads,6
,,False,IWasTheFirstKlund,,,smash-up,"[{'e': 'text', 't': 'Spirit Island'}]",9800fc9a-18ab-11e7-9f2e-0e1e04475714,Spirit Island,dark,richtext,t2_cb5nt,,,False,False,,False,,False,1535245295.0,1535216495.0,,,,self.boardgames,0,False,0,False,False,9a89xz,False,False,False,False,True,False,,,,[],,,dark,text,False,,{},False,,,,[],t3_9a89xz,True,35,0,,False,all_ads,/r/boardgames/comments/9a89xz/podcasters_need_to_tell_us_1_what_game_is_this/,False,,,6,False,,,False,0,,{},"I love listening to podcasts while driving, and learning about games that I haven't played. I have finally been able to put my finger on something that was bothering me - podcasters will talk about a game, explain it, say that they like it, etc... but I am not sure if it is *something that I should buy*.

Some are great at talking about a game and then telling me **what other games it is similar to** and, more importantly, **if it is better**. I don't have money or time to buy lots of games, and I don't want to buy a worse version of a game that I have.

Just make sure you tell me those two things!","&lt;!-- SC_OFF --&gt;&lt;div class=""md""&gt;&lt;p&gt;I love listening to podcasts while driving, and learning about games that I haven&amp;#39;t played. I have finally been able to put my finger on something that was bothering me - podcasters will talk about a game, explain it, say that they like it, etc... but I am not sure if it is &lt;em&gt;something that I should buy&lt;/em&gt;.&lt;/p&gt;

&lt;p&gt;Some are great at talking about a game and then telling me &lt;strong&gt;what other games it is similar to&lt;/strong&gt; and, more importantly, &lt;strong&gt;if it is better&lt;/strong&gt;. I don&amp;#39;t have money or time to buy lots of games, and I don&amp;#39;t want to buy a worse version of a game that I have.&lt;/p&gt;

&lt;p&gt;Just make sure you tell me those two things!&lt;/p&gt;
&lt;/div&gt;&lt;!-- SC_ON --&gt;",True,False,False,boardgames,t5_2qmjp,r/boardgames,887577,public,,self,,,Podcasters need to tell us: 1. What game is this game like? 2. Is it better?,0,https://www.reddit.com/r/boardgames/comments/9a89xz/podcasters_need_to_tell_us_1_what_game_is_this/,[],,False,all_ads,6
,,False,JBStevens6,,,,[],,,,text,t2_5hyw7,,,False,False,,False,,False,1535148678.0,1535119878.0,,,,self.boardgames,0,False,0,False,False,99xqex,False,False,False,False,True,False,,,,[],,,dark,text,False,,{},False,,,,[],t3_99xqex,False,65,0,,False,all_ads,/r/boardgames/comments/99xqex/non_coop_games_that_have_a_nonpoints/,False,,,6,False,,,False,34,,{},"What are some other games (non co-op) that determine the winner by some goal/condition rather than totaling up points at the end?

I recently played the game Quest for Fire and while it was a mostly forgettable game, I really liked how the winner is determined by achieving a goal (obtaining the Fire card) rather than everyone just building up a point total. After playing hundreds of games that just counting points it was a nice refresher to be going after some other win condition so I'm interested in hearing some thoughts on others.

I think alternate win conditions could fit this prompt as well, like how you can get a science or military intant-win in 7 Wonders Duel. King of Tokyo has stand-man-standing in addition to first-to-20.","&lt;!-- SC_OFF --&gt;&lt;div class=""md""&gt;&lt;p&gt;What are some other games (non co-op) that determine the winner by some goal/condition rather than totaling up points at the end?&lt;/p&gt;

&lt;p&gt;I recently played the game Quest for Fire and while it was a mostly forgettable game, I really liked how the winner is determined by achieving a goal (obtaining the Fire card) rather than everyone just building up a point total. After playing hundreds of games that just counting points it was a nice refresher to be going after some other win condition so I&amp;#39;m interested in hearing some thoughts on others.&lt;/p&gt;

&lt;p&gt;I think alternate win conditions could fit this prompt as well, like how you can get a science or military intant-win in 7 Wonders Duel. King of Tokyo has stand-man-standing in addition to first-to-20.&lt;/p&gt;
&lt;/div&gt;&lt;!-- SC_ON --&gt;",True,False,False,boardgames,t5_2qmjp,r/boardgames,887577,public,,self,,,Non co-op games that have a non-points determination of winner?,34,https://www.reddit.com/r/boardgames/comments/99xqex/non_coop_games_that_have_a_nonpoints/,[],,False,all_ads,6
,,False,U-1f419,,,,[],,,,text,t2_pusr1,,,False,False,,False,,False,1535144458.0,1535115658.0,,,,self.boardgames,0,1535116474.0,0,False,False,99x7kl,False,False,False,False,True,False,,,,[],,,dark,text,False,,{},False,,,,[],t3_99x7kl,False,16,0,,False,all_ads,/r/boardgames/comments/99x7kl/space_alert_turn_resolver_for_android/,False,,,6,False,,,False,44,,{},"Hey everybody, I've been working on this turn processor for Space Alert on and off for a while now and it's finally ready for release! 

It's not as pretty as the old flash version since the turn readout is all text but it should still make your resolution phase faster and more accurate.

Features: 

- All basic and advanced cards from the Space Alert base game. 

- Automatic processing of all player actions, threats damage, and threat actions. 

- Randomizes and appropriately applies damage tiles.

- Turn by turn text based readout of your game results. 

- End game scoring provided.


Please tell me if you encounter any bugs or inconsistencies in the text formatting, this turned out to be a pretty complicated project and I might have missed a thing or two.

https://play.google.com/store/apps/details?id=com.otto.spacealertresolver","&lt;!-- SC_OFF --&gt;&lt;div class=""md""&gt;&lt;p&gt;Hey everybody, I&amp;#39;ve been working on this turn processor for Space Alert on and off for a while now and it&amp;#39;s finally ready for release! &lt;/p&gt;

&lt;p&gt;It&amp;#39;s not as pretty as the old flash version since the turn readout is all text but it should still make your resolution phase faster and more accurate.&lt;/p&gt;

&lt;p&gt;Features: &lt;/p&gt;

&lt;ul&gt;
&lt;li&gt;&lt;p&gt;All basic and advanced cards from the Space Alert base game. &lt;/p&gt;&lt;/li&gt;
&lt;li&gt;&lt;p&gt;Automatic processing of all player actions, threats damage, and threat actions. &lt;/p&gt;&lt;/li&gt;
&lt;li&gt;&lt;p&gt;Randomizes and appropriately applies damage tiles.&lt;/p&gt;&lt;/li&gt;
&lt;li&gt;&lt;p&gt;Turn by turn text based readout of your game results. &lt;/p&gt;&lt;/li&gt;
&lt;li&gt;&lt;p&gt;End game scoring provided.&lt;/p&gt;&lt;/li&gt;
&lt;/ul&gt;

&lt;p&gt;Please tell me if you encounter any bugs or inconsistencies in the text formatting, this turned out to be a pretty complicated project and I might have missed a thing or two.&lt;/p&gt;

&lt;p&gt;&lt;a href=""https://play.google.com/store/apps/details?id=com.otto.spacealertresolver""&gt;https://play.google.com/store/apps/details?id=com.otto.spacealertresolver&lt;/a&gt;&lt;/p&gt;
&lt;/div&gt;&lt;!-- SC_ON --&gt;",True,False,False,boardgames,t5_2qmjp,r/boardgames,887577,public,,self,,,Space Alert turn resolver for android,44,https://www.reddit.com/r/boardgames/comments/99x7kl/space_alert_turn_resolver_for_android/,[],,False,all_ads,6
,,False,KNEZ90,,,,[],,,,text,t2_6dsd1,,,False,False,,False,,False,1535261166.0,1535232366.0,,,,youtube.com,0,False,0,False,False,9aaape,False,False,False,False,False,False,,,,[],,,dark,text,False,"{'type': 'youtube.com', 'oembed': {'provider_url': 'https://www.youtube.com/', 'title': 'Monopoly | House Rules', 'type': 'video', 'html': '&lt;iframe width=""600"" height=""338"" src=""https://www.youtube.com/embed/9Q0uI7DLAnc?feature=oembed&amp;enablejsapi=1"" frameborder=""0"" allow=""autoplay; encrypted-media"" allowfullscreen&gt;&lt;/iframe&gt;', 'author_name': 'R2i Games', 'height': 338, 'width': 600, 'version': '1.0', 'thumbnail_width': 480, 'provider_name': 'YouTube', 'thumbnail_url': 'https://i.ytimg.com/vi/9Q0uI7DLAnc/hqdefault.jpg', 'thumbnail_height': 360, 'author_url': 'https://www.youtube.com/channel/UCwDh6-kzLvuQ_u_zMELmR0g'}}","{'content': '&lt;iframe width=""600"" height=""338"" src=""https://www.youtube.com/embed/9Q0uI7DLAnc?feature=oembed&amp;enablejsapi=1"" frameborder=""0"" allow=""autoplay; encrypted-media"" allowfullscreen&gt;&lt;/iframe&gt;', 'width': 600, 'scrolling': False, 'height': 338}",False,,,,[],t3_9aaape,True,15,0,,False,all_ads,/r/boardgames/comments/9aaape/i_cant_believe_how_much_fun_monopoly_was_with/,False,rich:video,"{'images': [{'source': {'url': 'https://i.redditmedia.com/Ybv9pwPvgusBzLGoArLhWqlh0UZRZnuISAJnba0kVRM.jpg?s=e4a2bef374355af309eeafdbf900f588', 'width': 480, 'height': 360}, 'resolutions': [{'url': 'https://i.redditmedia.com/Ybv9pwPvgusBzLGoArLhWqlh0UZRZnuISAJnba0kVRM.jpg?fit=crop&amp;crop=faces%2Centropy&amp;arh=2&amp;w=108&amp;s=bd8b5577a871c455df802822cc5c23e6', 'width': 108, 'height': 81}, {'url': 'https://i.redditmedia.com/Ybv9pwPvgusBzLGoArLhWqlh0UZRZnuISAJnba0kVRM.jpg?fit=crop&amp;crop=faces%2Centropy&amp;arh=2&amp;w=216&amp;s=6834ee24485bf4d28e8547ebdb38731b', 'width': 216, 'height': 162}, {'url': 'https://i.redditmedia.com/Ybv9pwPvgusBzLGoArLhWqlh0UZRZnuISAJnba0kVRM.jpg?fit=crop&amp;crop=faces%2Centropy&amp;arh=2&amp;w=320&amp;s=05093c7938369a39087d82317f9b623f', 'width': 320, 'height': 240}], 'variants': {}, 'id': 'ZmgFTLed4ipDnoD5oltEES8wsTpvhbER1625-xDpjoQ'}], 'enabled': False}",6,False,,,False,0,"{'type': 'youtube.com', 'oembed': {'provider_url': 'https://www.youtube.com/', 'title': 'Monopoly | House Rules', 'type': 'video', 'html': '&lt;iframe width=""600"" height=""338"" src=""https://www.youtube.com/embed/9Q0uI7DLAnc?feature=oembed&amp;enablejsapi=1"" frameborder=""0"" allow=""autoplay; encrypted-media"" allowfullscreen&gt;&lt;/iframe&gt;', 'author_name': 'R2i Games', 'height': 338, 'width': 600, 'version': '1.0', 'thumbnail_width': 480, 'provider_name': 'YouTube', 'thumbnail_url': 'https://i.ytimg.com/vi/9Q0uI7DLAnc/hqdefault.jpg', 'thumbnail_height': 360, 'author_url': 'https://www.youtube.com/channel/UCwDh6-kzLvuQ_u_zMELmR0g'}}","{'content': '&lt;iframe width=""600"" height=""338"" src=""https://www.youtube.com/embed/9Q0uI7DLAnc?feature=oembed&amp;enablejsapi=1"" frameborder=""0"" allow=""autoplay; encrypted-media"" allowfullscreen&gt;&lt;/iframe&gt;', 'width': 600, 'scrolling': False, 'media_domain_url': 'https://www.redditmedia.com/mediaembed/9aaape', 'height': 338}",,,True,False,False,boardgames,t5_2qmjp,r/boardgames,887577,public,,https://b.thumbs.redditmedia.com/IUM7Vg3LSz14smO_cGEUTy4mcbZGbm3wnQbCoLtKDzw.jpg,105.0,140.0,I can't believe how much fun Monopoly was with these house rules!,0,https://www.youtube.com/watch?v=9Q0uI7DLAnc,[],,False,all_ads,6
