,,False,Dustdown,,,,[],,,,text,t2_67drj,,,False,False,,False,,False,1535418967.0,1535390167.0,,,,self.boardgames,0,1535471590.0,0,False,False,9aqu7t,False,False,False,False,True,False,,,,[],,,dark,text,False,,{},False,,,,[],t3_9aqu7t,False,104,0,,False,all_ads,/r/boardgames/comments/9aqu7t/hero_quest_is_awesome_but_whats_a_modern/,False,self,"{'images': [{'source': {'url': 'https://i.redditmedia.com/mtElMcPSGv89Uz-WJrF4Lhng7calPEuCp3zvPYzgiP8.jpg?s=8e89806bb391bc311b71833ec9054841', 'width': 928, 'height': 630}, 'resolutions': [{'url': 'https://i.redditmedia.com/mtElMcPSGv89Uz-WJrF4Lhng7calPEuCp3zvPYzgiP8.jpg?fit=crop&amp;crop=faces%2Centropy&amp;arh=2&amp;w=108&amp;s=d595f62d778186fa82d737717ac60c9f', 'width': 108, 'height': 73}, {'url': 'https://i.redditmedia.com/mtElMcPSGv89Uz-WJrF4Lhng7calPEuCp3zvPYzgiP8.jpg?fit=crop&amp;crop=faces%2Centropy&amp;arh=2&amp;w=216&amp;s=a86c6c7dea7687403e3e37dbae60c052', 'width': 216, 'height': 146}, {'url': 'https://i.redditmedia.com/mtElMcPSGv89Uz-WJrF4Lhng7calPEuCp3zvPYzgiP8.jpg?fit=crop&amp;crop=faces%2Centropy&amp;arh=2&amp;w=320&amp;s=dc6288a36cea0623f079f61cbd1f886f', 'width': 320, 'height': 217}, {'url': 'https://i.redditmedia.com/mtElMcPSGv89Uz-WJrF4Lhng7calPEuCp3zvPYzgiP8.jpg?fit=crop&amp;crop=faces%2Centropy&amp;arh=2&amp;w=640&amp;s=2c53647f5149cf5c9d026d0219a29637', 'width': 640, 'height': 434}], 'variants': {}, 'id': '3pAfD1JwSru352ZkPrXcoQwC1zxA0YrMfN6YRb0Od-M'}], 'enabled': False}",6,False,,,False,49,,{},"I loved Hero Quest for its craftsmanship and ability to double as a simplified RPG. 

I thought Descent would be a worthy follow-up, but its linearity and pure focus on complex combat put me off. It took two hours to set up the game, even with an experienced DM. And once the scenario started it was tiny with only one goal. 

In Hero Quest I had the ability to add extra flair to the game, with secret doors, monsters with personalities and extra rooms. I would even make my own treasure/weaponry cards. And the combat was so easy, any family member could join in. 

Is there any games out that has the same versatility?

And let's break it down, since I know so many people are looking for the same. 

What was awesome about Hero Quest?
This guy said it best.

* Awesome miniatures (and so simple/generic!)
* Awesome furniture, including THE DOORS!
* Fantastic, simple cards
* The beautiful board with procedural exploration (though I do love modular boards)
* The Quest Book - Lots of different scenarios, shown on just 2 pages each!
* The Box! Gosh do I love the art!
* GM Screen - My inspiration for all GameMasterings since! 
* Simple combat mechanics ( I don't mind more complex rules, but some overdo it)
* Expansions!


Here's my impression on current 'Hero Quest' successors stack up to that list!


**[Dungeon Saga](https://www.amazon.com/Mantic-Games-Dungeon-Saga-Dwarf/dp/B014IUO0NU#customerReviews)**
This REALLY looks awesome. Lots of expansions. Solid art style. Physical props. Simple treasure cards. Nice miniatures. Oooh, and are those door ways?! I like! 

But I have quality concerns. Sounds like the rulebook is a bit of a mess, games will show up damaged and it's a $100 investment to get it all. I don't mind putting in $120 and more for this game, but then it needs to be Hero Quest Quality with capital Q at least. :-)

**Gloomhaven**
Definitely a top contender, but I'm still trying to wrap my head around what the game actually is. Does it even have a GameMaster function? 

**Dungeons and Dragons Board Games**
Thanks for this suggestion! I didn't know you could combine these games. That's really interesting. But the maps I've seen so far were pretty uninspired and anything related to 4th edition is something I'm not sure about. Should I give it a go?

**Descent (2nd Ed)**
As mentioned above; I loved the look and feel of Descent , but for my purposes (getting my wife and beginners into RPG's) the game was too complex and felt too linear. The scenario starts and you must move from point A to point B, with no additional exploration or fun. 

In Hero Quest the GameMaster had the quiet choice of adding or removing a minion to make the game harder or easier for the players. Making such a decision in Descent didn't seem like an option as it'd leave a gaping hole in the plot. I only played 3 scenarios, so I could be wrong. 

**Massive Darkness**
Lots to like here, but it seems to lack the GM function and custom scenario parts I loved about Hero Quest. 

**[Warhammer Quest - Shadows of Hammerhal](https://boardgamegeek.com/boardgame/218933/warhammer-quest-shadows-over-hammerhal)**
Giving this a look now. I might be able to overcome the Warhammer stigma if there's some flexibility in making your own maps here. Hmmm. 

**Mice &amp; Mystics**
Love the look, but from what I understand this is a very scenario, railroaded game. 


**Arcadia Quest**
If I can overcome the artstyle (it's well done, but not my cup of cute), I still don't like that there's only 9 map tiles in the game?


**Imperial Assault**
Love the game, but I have the same concerns as with Descent. Plus the setting isn't what I need. Gotta get me some sword and sorcery!



Browsing... stand by...
...


...

..

.","&lt;!-- SC_OFF --&gt;&lt;div class=""md""&gt;&lt;p&gt;I loved Hero Quest for its craftsmanship and ability to double as a simplified RPG. &lt;/p&gt;

&lt;p&gt;I thought Descent would be a worthy follow-up, but its linearity and pure focus on complex combat put me off. It took two hours to set up the game, even with an experienced DM. And once the scenario started it was tiny with only one goal. &lt;/p&gt;

&lt;p&gt;In Hero Quest I had the ability to add extra flair to the game, with secret doors, monsters with personalities and extra rooms. I would even make my own treasure/weaponry cards. And the combat was so easy, any family member could join in. &lt;/p&gt;

&lt;p&gt;Is there any games out that has the same versatility?&lt;/p&gt;

&lt;p&gt;And let&amp;#39;s break it down, since I know so many people are looking for the same. &lt;/p&gt;

&lt;p&gt;What was awesome about Hero Quest?
This guy said it best.&lt;/p&gt;

&lt;ul&gt;
&lt;li&gt;Awesome miniatures (and so simple/generic!)&lt;/li&gt;
&lt;li&gt;Awesome furniture, including THE DOORS!&lt;/li&gt;
&lt;li&gt;Fantastic, simple cards&lt;/li&gt;
&lt;li&gt;The beautiful board with procedural exploration (though I do love modular boards)&lt;/li&gt;
&lt;li&gt;The Quest Book - Lots of different scenarios, shown on just 2 pages each!&lt;/li&gt;
&lt;li&gt;The Box! Gosh do I love the art!&lt;/li&gt;
&lt;li&gt;GM Screen - My inspiration for all GameMasterings since! &lt;/li&gt;
&lt;li&gt;Simple combat mechanics ( I don&amp;#39;t mind more complex rules, but some overdo it)&lt;/li&gt;
&lt;li&gt;Expansions!&lt;/li&gt;
&lt;/ul&gt;

&lt;p&gt;Here&amp;#39;s my impression on current &amp;#39;Hero Quest&amp;#39; successors stack up to that list!&lt;/p&gt;

&lt;p&gt;&lt;strong&gt;&lt;a href=""https://www.amazon.com/Mantic-Games-Dungeon-Saga-Dwarf/dp/B014IUO0NU#customerReviews""&gt;Dungeon Saga&lt;/a&gt;&lt;/strong&gt;
This REALLY looks awesome. Lots of expansions. Solid art style. Physical props. Simple treasure cards. Nice miniatures. Oooh, and are those door ways?! I like! &lt;/p&gt;

&lt;p&gt;But I have quality concerns. Sounds like the rulebook is a bit of a mess, games will show up damaged and it&amp;#39;s a $100 investment to get it all. I don&amp;#39;t mind putting in $120 and more for this game, but then it needs to be Hero Quest Quality with capital Q at least. :-)&lt;/p&gt;

&lt;p&gt;&lt;strong&gt;Gloomhaven&lt;/strong&gt;
Definitely a top contender, but I&amp;#39;m still trying to wrap my head around what the game actually is. Does it even have a GameMaster function? &lt;/p&gt;

&lt;p&gt;&lt;strong&gt;Dungeons and Dragons Board Games&lt;/strong&gt;
Thanks for this suggestion! I didn&amp;#39;t know you could combine these games. That&amp;#39;s really interesting. But the maps I&amp;#39;ve seen so far were pretty uninspired and anything related to 4th edition is something I&amp;#39;m not sure about. Should I give it a go?&lt;/p&gt;

&lt;p&gt;&lt;strong&gt;Descent (2nd Ed)&lt;/strong&gt;
As mentioned above; I loved the look and feel of Descent , but for my purposes (getting my wife and beginners into RPG&amp;#39;s) the game was too complex and felt too linear. The scenario starts and you must move from point A to point B, with no additional exploration or fun. &lt;/p&gt;

&lt;p&gt;In Hero Quest the GameMaster had the quiet choice of adding or removing a minion to make the game harder or easier for the players. Making such a decision in Descent didn&amp;#39;t seem like an option as it&amp;#39;d leave a gaping hole in the plot. I only played 3 scenarios, so I could be wrong. &lt;/p&gt;

&lt;p&gt;&lt;strong&gt;Massive Darkness&lt;/strong&gt;
Lots to like here, but it seems to lack the GM function and custom scenario parts I loved about Hero Quest. &lt;/p&gt;

&lt;p&gt;&lt;strong&gt;&lt;a href=""https://boardgamegeek.com/boardgame/218933/warhammer-quest-shadows-over-hammerhal""&gt;Warhammer Quest - Shadows of Hammerhal&lt;/a&gt;&lt;/strong&gt;
Giving this a look now. I might be able to overcome the Warhammer stigma if there&amp;#39;s some flexibility in making your own maps here. Hmmm. &lt;/p&gt;

&lt;p&gt;&lt;strong&gt;Mice &amp;amp; Mystics&lt;/strong&gt;
Love the look, but from what I understand this is a very scenario, railroaded game. &lt;/p&gt;

&lt;p&gt;&lt;strong&gt;Arcadia Quest&lt;/strong&gt;
If I can overcome the artstyle (it&amp;#39;s well done, but not my cup of cute), I still don&amp;#39;t like that there&amp;#39;s only 9 map tiles in the game?&lt;/p&gt;

&lt;p&gt;&lt;strong&gt;Imperial Assault&lt;/strong&gt;
Love the game, but I have the same concerns as with Descent. Plus the setting isn&amp;#39;t what I need. Gotta get me some sword and sorcery!&lt;/p&gt;

&lt;p&gt;Browsing... stand by...
...&lt;/p&gt;

&lt;p&gt;...&lt;/p&gt;

&lt;p&gt;..&lt;/p&gt;

&lt;p&gt;.&lt;/p&gt;
&lt;/div&gt;&lt;!-- SC_ON --&gt;",True,False,False,boardgames,t5_2qmjp,r/boardgames,887575,public,,self,,,Hero Quest is awesome. But what's a modern equivalent?,49,https://www.reddit.com/r/boardgames/comments/9aqu7t/hero_quest_is_awesome_but_whats_a_modern/,[],,False,all_ads,6
,,False,ixiduffixi,,,,[],,,,text,t2_8bnvy,,,False,False,,False,,False,1535442353.0,1535413553.0,,,,self.boardgames,0,False,0,False,False,9au0aa,False,False,False,False,True,False,,,,[],,,dark,text,False,,{},False,,,,[],t3_9au0aa,False,5,0,,False,all_ads,/r/boardgames/comments/9au0aa/dice_forge_alternate_dice_face_storage_temple/,False,,,6,False,,,False,13,,{},"Now I know this is a pretty bizarre question given that the storage of the game is pretty fantastic, but has anyone found an alternate tray or something to use for the dice faces (Temple)?

I have an issue with my hands where they have constant tremors and flipping or removing the dice face from the temple tray is borderline abysmal. It's in no way put me off from playing the game, but I'd love to have sort of alternative to use so I don't spend minutes trying to fix whatever dice face I have happened to knock loose from it's place.","&lt;!-- SC_OFF --&gt;&lt;div class=""md""&gt;&lt;p&gt;Now I know this is a pretty bizarre question given that the storage of the game is pretty fantastic, but has anyone found an alternate tray or something to use for the dice faces (Temple)?&lt;/p&gt;

&lt;p&gt;I have an issue with my hands where they have constant tremors and flipping or removing the dice face from the temple tray is borderline abysmal. It&amp;#39;s in no way put me off from playing the game, but I&amp;#39;d love to have sort of alternative to use so I don&amp;#39;t spend minutes trying to fix whatever dice face I have happened to knock loose from it&amp;#39;s place.&lt;/p&gt;
&lt;/div&gt;&lt;!-- SC_ON --&gt;",True,False,False,boardgames,t5_2qmjp,r/boardgames,887575,public,,self,,,"Dice Forge, alternate dice face storage (temple).",13,https://www.reddit.com/r/boardgames/comments/9au0aa/dice_forge_alternate_dice_face_storage_temple/,[],,False,all_ads,6
,,False,otk_boi,,,,[],,,,text,t2_vzsnlpm,,,False,False,,False,,False,1535432363.0,1535403563.0,,,,self.boardgames,0,False,0,False,False,9asqpt,False,False,False,False,True,False,,,,[],,,dark,text,False,,{},False,,,,[],t3_9asqpt,False,35,0,,False,all_ads,/r/boardgames/comments/9asqpt/disneys_villainous_cauldron/,False,,,6,False,,,False,20,,{},"Hey folks. 
I just got this wonderful game today. I played as Maleficent against Prince John by myself to get a feel for everything before playing with friends. 

It’s great, easy to understand and everything looks polished in a way I think I can even get my not so board-gamy friends to play this just because of the theme.

Only thing that really bothers me is this cauldron. Like could they have made something that looks and feels any cheaper? I don’t think so. This thing is a disgrace in my opinion. 

The game is good enough that I’ll deal with it, but they should have done a better job in a licensed product. 

Am I the only one displeased about this? No review I read mentioned this. 

Is it maybe possible they deliver something better with an expansion?
Did someone find a thematic, higher quality alternative? 

Thanks for reading :)","&lt;!-- SC_OFF --&gt;&lt;div class=""md""&gt;&lt;p&gt;Hey folks. 
I just got this wonderful game today. I played as Maleficent against Prince John by myself to get a feel for everything before playing with friends. &lt;/p&gt;

&lt;p&gt;It’s great, easy to understand and everything looks polished in a way I think I can even get my not so board-gamy friends to play this just because of the theme.&lt;/p&gt;

&lt;p&gt;Only thing that really bothers me is this cauldron. Like could they have made something that looks and feels any cheaper? I don’t think so. This thing is a disgrace in my opinion. &lt;/p&gt;

&lt;p&gt;The game is good enough that I’ll deal with it, but they should have done a better job in a licensed product. &lt;/p&gt;

&lt;p&gt;Am I the only one displeased about this? No review I read mentioned this. &lt;/p&gt;

&lt;p&gt;Is it maybe possible they deliver something better with an expansion?
Did someone find a thematic, higher quality alternative? &lt;/p&gt;

&lt;p&gt;Thanks for reading :)&lt;/p&gt;
&lt;/div&gt;&lt;!-- SC_ON --&gt;",True,False,False,boardgames,t5_2qmjp,r/boardgames,887578,public,,self,,,Disney’s Villainous Cauldron,20,https://www.reddit.com/r/boardgames/comments/9asqpt/disneys_villainous_cauldron/,[],,False,all_ads,6
,,False,TheTrueJay,,,,[],,,,text,t2_m1kyz,,,False,False,,False,,False,1535460101.0,1535431301.0,,,,self.boardgames,0,False,0,False,False,9avzpd,False,False,False,False,True,False,,,rules,"[{'e': 'text', 't': 'Rules'}]",e048502e-709a-11e7-9f79-0e36a8135aee,Rules,dark,richtext,False,,{},False,,,,[],t3_9avzpd,False,1,0,,False,all_ads,/r/boardgames/comments/9avzpd/the_thing_card_game_when_do_you_used_crew_deck_2/,False,,,6,False,,,False,4,,{},The same for the thing deck 2 and 3. Ive looked through the rules and can't figure it out?,"&lt;!-- SC_OFF --&gt;&lt;div class=""md""&gt;&lt;p&gt;The same for the thing deck 2 and 3. Ive looked through the rules and can&amp;#39;t figure it out?&lt;/p&gt;
&lt;/div&gt;&lt;!-- SC_ON --&gt;",True,False,False,boardgames,t5_2qmjp,r/boardgames,887578,public,,self,,,"The Thing Card Game, when do you used crew deck 2 and 3?",4,https://www.reddit.com/r/boardgames/comments/9avzpd/the_thing_card_game_when_do_you_used_crew_deck_2/,[],,False,all_ads,6
,,False,intrinsic_space,,,,[],,,,text,t2_14j4lf,,,False,False,,False,,False,1535446038.0,1535417238.0,,,,self.boardgames,0,False,0,False,False,9aufn6,False,False,False,False,True,False,,,,[],,,dark,text,False,,{},False,,,,[],t3_9aufn6,False,7,0,,False,all_ads,/r/boardgames/comments/9aufn6/what_website_showcases_little_known_yet_fun_board/,False,self,"{'images': [{'source': {'url': 'https://i.redditmedia.com/2O_z4WuvmEmAZOp8yj5RhdoSbYVzgVPFpNsUqEOH_Fw.jpg?s=637195b3e868b8ff459fd714e2ad1cc1', 'width': 350, 'height': 380}, 'resolutions': [{'url': 'https://i.redditmedia.com/2O_z4WuvmEmAZOp8yj5RhdoSbYVzgVPFpNsUqEOH_Fw.jpg?fit=crop&amp;crop=faces%2Centropy&amp;arh=2&amp;w=108&amp;s=6c28d3ae6a85f5aba9fb2e6857ce9e77', 'width': 108, 'height': 117}, {'url': 'https://i.redditmedia.com/2O_z4WuvmEmAZOp8yj5RhdoSbYVzgVPFpNsUqEOH_Fw.jpg?fit=crop&amp;crop=faces%2Centropy&amp;arh=2&amp;w=216&amp;s=b3dc46312c2811fde043cad952ca7a60', 'width': 216, 'height': 234}, {'url': 'https://i.redditmedia.com/2O_z4WuvmEmAZOp8yj5RhdoSbYVzgVPFpNsUqEOH_Fw.jpg?fit=crop&amp;crop=faces%2Centropy&amp;arh=2&amp;w=320&amp;s=4db45f43a2834e021f70671fda5a9cf2', 'width': 320, 'height': 347}], 'variants': {}, 'id': 'w1snvpfzP6H_YgLwsL8R1ISdF3tL5uv6AV5csrRA2CE'}], 'enabled': False}",6,False,,,False,7,,{},"Ever since I left my main gaming groups last year I've relied more on BGG to see what titles are coming out and what looks like fun. I'm not subsumed in the cult of the new but there was a certain serendipity where someone would break out a game I've never seen before like [Tumple](https://www.amazon.com/gp/product/B00YEO9D9M/ref=ox_sc_sfl_title_2?ie=UTF8&amp;psc=1&amp;smid=A2E5NMG7YITTHA), a sort of reverse jenga, [Custom Heroes](https://www.amazon.com/gp/product/B07117V56Q/ref=ox_sc_sfl_title_153?ie=UTF8&amp;psc=1&amp;smid=ATVPDKIKX0DER), or Burgle Bros - something different, something fun.

So I'm curious if there's a site which has a finger on the pulse and can find new and different games that won't necessarily be on the BGG hotness. And ideally it would be a website or blog and not a podcast so I could see what they're talking about!","&lt;!-- SC_OFF --&gt;&lt;div class=""md""&gt;&lt;p&gt;Ever since I left my main gaming groups last year I&amp;#39;ve relied more on BGG to see what titles are coming out and what looks like fun. I&amp;#39;m not subsumed in the cult of the new but there was a certain serendipity where someone would break out a game I&amp;#39;ve never seen before like &lt;a href=""https://www.amazon.com/gp/product/B00YEO9D9M/ref=ox_sc_sfl_title_2?ie=UTF8&amp;amp;psc=1&amp;amp;smid=A2E5NMG7YITTHA""&gt;Tumple&lt;/a&gt;, a sort of reverse jenga, &lt;a href=""https://www.amazon.com/gp/product/B07117V56Q/ref=ox_sc_sfl_title_153?ie=UTF8&amp;amp;psc=1&amp;amp;smid=ATVPDKIKX0DER""&gt;Custom Heroes&lt;/a&gt;, or Burgle Bros - something different, something fun.&lt;/p&gt;

&lt;p&gt;So I&amp;#39;m curious if there&amp;#39;s a site which has a finger on the pulse and can find new and different games that won&amp;#39;t necessarily be on the BGG hotness. And ideally it would be a website or blog and not a podcast so I could see what they&amp;#39;re talking about!&lt;/p&gt;
&lt;/div&gt;&lt;!-- SC_ON --&gt;",True,False,False,boardgames,t5_2qmjp,r/boardgames,887578,public,,self,,,What website showcases little known yet fun board games?,7,https://www.reddit.com/r/boardgames/comments/9aufn6/what_website_showcases_little_known_yet_fun_board/,[],,False,all_ads,6
,,False,QuellSpeller,,,dominant-species,"[{'e': 'text', 't': 'Dominant Species'}]",6eb390b0-18aa-11e7-9c35-0e7407c9ec7a,Dominant Species,dark,richtext,t2_zsamk,,,False,False,,False,,False,1535422624.0,1535393824.0,,,,self.boardgames,0,False,0,False,False,9ardpy,False,False,False,False,True,False,,#cd0000,,"[{'e': 'text', 't': 'WDYP'}]",bd2b04ea-cd3f-11e7-8687-0e429c0e4e38,WDYP,light,richtext,False,,{},False,,,,[],t3_9ardpy,False,115,0,,False,all_ads,/r/boardgames/comments/9ardpy/what_did_you_play_this_week_aug_20_aug_26/,False,,,6,False,,,False,26,,{},"Happy Monday, /r/boardgames! 

It's time to hear what games everyone has been playing for the past ~7 days. Please feel free to share any insights, anecdotes, or thoughts that may have arisen during the course of play. Also, don't forget to comment and discuss other peoples' games too.

*****

The following questions are intended to facilitate further discussion. 

* Weekly Question: What's your favorite ""bad"" game, or guilty pleasure game? I know we've all got them, the ones that you try not to let your board game friends know you're playing.","&lt;!-- SC_OFF --&gt;&lt;div class=""md""&gt;&lt;p&gt;Happy Monday, &lt;a href=""/r/boardgames""&gt;/r/boardgames&lt;/a&gt;! &lt;/p&gt;

&lt;p&gt;It&amp;#39;s time to hear what games everyone has been playing for the past ~7 days. Please feel free to share any insights, anecdotes, or thoughts that may have arisen during the course of play. Also, don&amp;#39;t forget to comment and discuss other peoples&amp;#39; games too.&lt;/p&gt;

&lt;hr/&gt;

&lt;p&gt;The following questions are intended to facilitate further discussion. &lt;/p&gt;

&lt;ul&gt;
&lt;li&gt;Weekly Question: What&amp;#39;s your favorite &amp;quot;bad&amp;quot; game, or guilty pleasure game? I know we&amp;#39;ve all got them, the ones that you try not to let your board game friends know you&amp;#39;re playing.&lt;/li&gt;
&lt;/ul&gt;
&lt;/div&gt;&lt;!-- SC_ON --&gt;",False,False,False,boardgames,t5_2qmjp,r/boardgames,887578,public,new,self,,,What Did You Play This Week? (Aug 20 - Aug 26),26,https://www.reddit.com/r/boardgames/comments/9ardpy/what_did_you_play_this_week_aug_20_aug_26/,[],,False,all_ads,6
,,False,peppermunch,,,,[],,,,text,t2_g230d,,,False,False,,False,,False,1535471559.0,1535442759.0,,,,self.boardgames,0,1535467909.0,0,False,False,9awzgw,False,False,False,False,True,False,,,,[],,,dark,text,False,,{},False,,,,[],t3_9awzgw,False,25,0,,False,all_ads,/r/boardgames/comments/9awzgw/whats_a_game_that_youve_only_played_once_that/,False,,,6,False,,,False,4,,{},"This hobby is all about sharing, and I love that so very much. The only downside is that when you have friends that have a lot of boardgames, they hardly want to play the same thing multiple times (with a few exceptions to the rule, of course). That can lead to you playing a game that you absolutely *loved,* without much hope of playing it again for quite some time.


Of course that normally means you just get to play more games and that's awesome, but it begs the question:


*What games have you played only once that you are just aching to play again?*


I think my top two are: 

**Deus**: The box art and theme are so boring that I would never have picked this game up unless my friend convinced me it was good. He told me ""After playing this game, you'll never need to play another engine builder again."" And my gods was he right. I mean, I'm going to play another engine builder at some stage of my life, but this one just hit all the right buttons for me. The compounding actions and simple, easy to read board/strategy was just perfect for me. 


**Inis**: It's just beautiful and simple and complex and I love it. There's more than enough people going on about how good this game is so I'll leave it up to them.


Quick edit: What is the reason for being down voted? Just wanting to know so I don't annoy people in the future.","&lt;!-- SC_OFF --&gt;&lt;div class=""md""&gt;&lt;p&gt;This hobby is all about sharing, and I love that so very much. The only downside is that when you have friends that have a lot of boardgames, they hardly want to play the same thing multiple times (with a few exceptions to the rule, of course). That can lead to you playing a game that you absolutely &lt;em&gt;loved,&lt;/em&gt; without much hope of playing it again for quite some time.&lt;/p&gt;

&lt;p&gt;Of course that normally means you just get to play more games and that&amp;#39;s awesome, but it begs the question:&lt;/p&gt;

&lt;p&gt;&lt;em&gt;What games have you played only once that you are just aching to play again?&lt;/em&gt;&lt;/p&gt;

&lt;p&gt;I think my top two are: &lt;/p&gt;

&lt;p&gt;&lt;strong&gt;Deus&lt;/strong&gt;: The box art and theme are so boring that I would never have picked this game up unless my friend convinced me it was good. He told me &amp;quot;After playing this game, you&amp;#39;ll never need to play another engine builder again.&amp;quot; And my gods was he right. I mean, I&amp;#39;m going to play another engine builder at some stage of my life, but this one just hit all the right buttons for me. The compounding actions and simple, easy to read board/strategy was just perfect for me. &lt;/p&gt;

&lt;p&gt;&lt;strong&gt;Inis&lt;/strong&gt;: It&amp;#39;s just beautiful and simple and complex and I love it. There&amp;#39;s more than enough people going on about how good this game is so I&amp;#39;ll leave it up to them.&lt;/p&gt;

&lt;p&gt;Quick edit: What is the reason for being down voted? Just wanting to know so I don&amp;#39;t annoy people in the future.&lt;/p&gt;
&lt;/div&gt;&lt;!-- SC_ON --&gt;",True,False,False,boardgames,t5_2qmjp,r/boardgames,887578,public,,self,,,What's a game that you've only played once that you'd love to play again?,4,https://www.reddit.com/r/boardgames/comments/9awzgw/whats_a_game_that_youve_only_played_once_that/,[],,False,all_ads,6
