approved_at_utc,approved_by,archived,author,author_cakeday,author_flair_background_color,author_flair_css_class,author_flair_richtext,author_flair_template_id,author_flair_text,author_flair_text_color,author_flair_type,author_fullname,banned_at_utc,banned_by,can_gild,can_mod_post,category,clicked,content_categories,contest_mode,created,created_utc,crosspost_parent,crosspost_parent_list,distinguished,domain,downs,edited,gilded,hidden,hide_score,id,is_crosspostable,is_meta,is_original_content,is_reddit_media_domain,is_self,is_video,likes,link_flair_background_color,link_flair_css_class,link_flair_richtext,link_flair_template_id,link_flair_text,link_flair_text_color,link_flair_type,locked,media,media_embed,media_only,mod_note,mod_reason_by,mod_reason_title,mod_reports,name,no_follow,num_comments,num_crossposts,num_reports,over_18,parent_whitelist_status,permalink,pinned,post_hint,preview,pwls,quarantine,removal_reason,report_reasons,saved,score,secure_media,secure_media_embed,selftext,selftext_html,send_replies,spoiler,stickied,subreddit,subreddit_id,subreddit_name_prefixed,subreddit_subscribers,subreddit_type,suggested_sort,thumbnail,thumbnail_height,thumbnail_width,title,ups,url,user_reports,view_count,visited,whitelist_status,wls
,,False,AutoModerator,,#d0fffd,,"[{'e': 'text', 't': '🤖'}]",326005ee-9cf2-11e8-8b1f-0e8f9a199476,🤖,dark,richtext,t2_6l4z3,,,False,False,,False,,False,1535485893.0,1535457093.0,,,moderator,self.boardgames,0,False,0,False,False,9ay87t,False,False,False,False,True,False,,#4a4b4a,,"[{'e': 'text', 't': 'Daily Game Recs'}]",01476204-cd40-11e7-a8ba-0e829f432fc8,Daily Game Recs,light,richtext,False,,{},False,,,,[],t3_9ay87t,True,104,1,,False,all_ads,/r/boardgames/comments/9ay87t/rboardgames_daily_discussion_and_game/,False,,,6,False,,,False,8,,{},"**Welcome to /r/boardgames Daily Discussion and Game Recommendations**

This is meant to be a place where you can ask any and all questions relating to the board gaming world: general or specific game recommendations, rule clarifications, definitions of terms/acronyms, and other quick questions that might not warrant their own post. 

If you are seeking game recommendations you will get better responses if you give us enough background to help you. You can use [this template](https://www.reddit.com/r/boardgames/wiki/personalized-game-recommendation-template-no-explainer) to do so. [Here](https://www.reddit.com/r/boardgames/wiki/personalized-game-recommendation-template) is a version with explanations of what we're looking for.  

If you reply to any comment that has a game name in **bold** with ""**/u/r2d8 getparentinfo**"", one of our robots will tell you more about the game

Just remember that this is a community full of awesome, helpful people, and feel free to ask your questions whatever they may be. As always, keep it civil and remember what the downvote button is actually for.


Lastly, here are some of the resources available at /r/boardgames:

* If you are new here, be sure to check out our [Community Guidelines](https://www.reddit.com/r/boardgames/wiki/community)
* If you are looking for a game recommendation, make sure to read our [What Should I Get Wiki](https://www.reddit.com/r/boardgames/wiki/wsig)
* If asking people for recommendations is too interactive: [The Automated Recommendations Robot is here for you](https://www.reddit.com/r/boardgames/wiki/wsig#wiki_ask_a_robot_for_a_list_of_recommendations).
* Also take a look at our [Wiki Index](https://www.reddit.com/r/boardgames/wiki/index) for various other resources and information.
* Any questions about game design can be answered here, but also visit /r/tabletopgamedesign
* Any discussions about the subreddit itself should be contained in /r/metaboardgames

*If you use the boardgamerecommender bot in this thread, please reply to the stickied top comment in order to avoid cluttering up the posts.*

Happy gaming!
","&lt;!-- SC_OFF --&gt;&lt;div class=""md""&gt;&lt;p&gt;&lt;strong&gt;Welcome to &lt;a href=""/r/boardgames""&gt;/r/boardgames&lt;/a&gt; Daily Discussion and Game Recommendations&lt;/strong&gt;&lt;/p&gt;

&lt;p&gt;This is meant to be a place where you can ask any and all questions relating to the board gaming world: general or specific game recommendations, rule clarifications, definitions of terms/acronyms, and other quick questions that might not warrant their own post. &lt;/p&gt;

&lt;p&gt;If you are seeking game recommendations you will get better responses if you give us enough background to help you. You can use &lt;a href=""https://www.reddit.com/r/boardgames/wiki/personalized-game-recommendation-template-no-explainer""&gt;this template&lt;/a&gt; to do so. &lt;a href=""https://www.reddit.com/r/boardgames/wiki/personalized-game-recommendation-template""&gt;Here&lt;/a&gt; is a version with explanations of what we&amp;#39;re looking for.  &lt;/p&gt;

&lt;p&gt;If you reply to any comment that has a game name in &lt;strong&gt;bold&lt;/strong&gt; with &amp;quot;&lt;strong&gt;&lt;a href=""/u/r2d8""&gt;/u/r2d8&lt;/a&gt; getparentinfo&lt;/strong&gt;&amp;quot;, one of our robots will tell you more about the game&lt;/p&gt;

&lt;p&gt;Just remember that this is a community full of awesome, helpful people, and feel free to ask your questions whatever they may be. As always, keep it civil and remember what the downvote button is actually for.&lt;/p&gt;

&lt;p&gt;Lastly, here are some of the resources available at &lt;a href=""/r/boardgames""&gt;/r/boardgames&lt;/a&gt;:&lt;/p&gt;

&lt;ul&gt;
&lt;li&gt;If you are new here, be sure to check out our &lt;a href=""https://www.reddit.com/r/boardgames/wiki/community""&gt;Community Guidelines&lt;/a&gt;&lt;/li&gt;
&lt;li&gt;If you are looking for a game recommendation, make sure to read our &lt;a href=""https://www.reddit.com/r/boardgames/wiki/wsig""&gt;What Should I Get Wiki&lt;/a&gt;&lt;/li&gt;
&lt;li&gt;If asking people for recommendations is too interactive: &lt;a href=""https://www.reddit.com/r/boardgames/wiki/wsig#wiki_ask_a_robot_for_a_list_of_recommendations""&gt;The Automated Recommendations Robot is here for you&lt;/a&gt;.&lt;/li&gt;
&lt;li&gt;Also take a look at our &lt;a href=""https://www.reddit.com/r/boardgames/wiki/index""&gt;Wiki Index&lt;/a&gt; for various other resources and information.&lt;/li&gt;
&lt;li&gt;Any questions about game design can be answered here, but also visit &lt;a href=""/r/tabletopgamedesign""&gt;/r/tabletopgamedesign&lt;/a&gt;&lt;/li&gt;
&lt;li&gt;Any discussions about the subreddit itself should be contained in &lt;a href=""/r/metaboardgames""&gt;/r/metaboardgames&lt;/a&gt;&lt;/li&gt;
&lt;/ul&gt;

&lt;p&gt;&lt;em&gt;If you use the boardgamerecommender bot in this thread, please reply to the stickied top comment in order to avoid cluttering up the posts.&lt;/em&gt;&lt;/p&gt;

&lt;p&gt;Happy gaming!&lt;/p&gt;
&lt;/div&gt;&lt;!-- SC_ON --&gt;",False,False,True,boardgames,t5_2qmjp,r/boardgames,887575,public,new,self,,,"/r/boardgames Daily Discussion and Game Recommendations (August 28, 2018)",8,https://www.reddit.com/r/boardgames/comments/9ay87t/rboardgames_daily_discussion_and_game/,[],,False,all_ads,6
,,False,Linuxguy091,,,,[],,,,text,t2_1ltcwqfz,,,False,False,,False,,False,1535498229.0,1535469429.0,,,,self.boardgames,0,False,0,False,False,9azs1a,False,False,False,False,True,False,,,session,"[{'e': 'text', 't': 'Session'}]",afa9b77a-4636-11e2-9037-12313d14a568,Session,dark,richtext,False,,{},False,,,,[],t3_9azs1a,False,327,0,,False,all_ads,/r/boardgames/comments/9azs1a/im_tired_of_hearing_this_game_looks_is_too/,False,,,6,False,,,False,400,,{},"I'm going to apologize in advance if this runs a bit long. I have some friends that I have slowly been introducing more modern board games to. One of the first games I introduced was Betrayal at House on the Hill and it wound up being a hit. To add a bit of variety every once in a while I've been bringing over some other games along with Betrayal. I try to bring over stuff that's relatively simple for people who don't play board games and I'm starting to feel like they're just saying a game looks/ is complicated out of laziness. 


Some examples of games I've tried to show them that are simple are Ticket to Ride, and Battle Wizards Duel at mount Skullzfyre. The rules and mechanics are simple but they just dismiss it with it looks complicated or sounds complicated when I explain the rules even with a demonstration. I've been hoping to get them eventually up to where they may be willing to try something with a bit more depth like fury of dracula or eldritch horror but it doesn't look viable. Do you guys have any advice on getting people to try new games or stories similar to what I'm going through? I'd love to hear from you guys. Also I apologize if I selected the wrong flair. ","&lt;!-- SC_OFF --&gt;&lt;div class=""md""&gt;&lt;p&gt;I&amp;#39;m going to apologize in advance if this runs a bit long. I have some friends that I have slowly been introducing more modern board games to. One of the first games I introduced was Betrayal at House on the Hill and it wound up being a hit. To add a bit of variety every once in a while I&amp;#39;ve been bringing over some other games along with Betrayal. I try to bring over stuff that&amp;#39;s relatively simple for people who don&amp;#39;t play board games and I&amp;#39;m starting to feel like they&amp;#39;re just saying a game looks/ is complicated out of laziness. &lt;/p&gt;

&lt;p&gt;Some examples of games I&amp;#39;ve tried to show them that are simple are Ticket to Ride, and Battle Wizards Duel at mount Skullzfyre. The rules and mechanics are simple but they just dismiss it with it looks complicated or sounds complicated when I explain the rules even with a demonstration. I&amp;#39;ve been hoping to get them eventually up to where they may be willing to try something with a bit more depth like fury of dracula or eldritch horror but it doesn&amp;#39;t look viable. Do you guys have any advice on getting people to try new games or stories similar to what I&amp;#39;m going through? I&amp;#39;d love to hear from you guys. Also I apologize if I selected the wrong flair. &lt;/p&gt;
&lt;/div&gt;&lt;!-- SC_ON --&gt;",True,False,False,boardgames,t5_2qmjp,r/boardgames,887575,public,,self,,,"I'm tired of hearing ""This game looks/ is too complicated"" and am starting to get discouraged in introducing new board games. Any advice would be greatly appreciated.",400,https://www.reddit.com/r/boardgames/comments/9azs1a/im_tired_of_hearing_this_game_looks_is_too/,[],,False,all_ads,6
,,False,Akahz,,,,[],,,,text,t2_ka9gj,,,False,False,,False,,False,1535508610.0,1535479810.0,,,,humblebundle.com,0,False,0,False,False,9b19ub,False,False,False,False,False,False,,,,[],,,dark,text,False,,{},False,,,,[],t3_9b19ub,False,14,0,,False,all_ads,/r/boardgames/comments/9b19ub/several_digital_boardgames_are_offered_on_humble/,False,link,"{'images': [{'source': {'url': 'https://i.redditmedia.com/T1v9EE6xysmzarwBVXvG0BRvak6WuExgedi3fA6a3lc.jpg?s=5872ce654a7003924b04008bb33e1edb', 'width': 1200, 'height': 630}, 'resolutions': [{'url': 'https://i.redditmedia.com/T1v9EE6xysmzarwBVXvG0BRvak6WuExgedi3fA6a3lc.jpg?fit=crop&amp;crop=faces%2Centropy&amp;arh=2&amp;w=108&amp;s=b524c8d3cd23e7eaedf65d076c71659e', 'width': 108, 'height': 56}, {'url': 'https://i.redditmedia.com/T1v9EE6xysmzarwBVXvG0BRvak6WuExgedi3fA6a3lc.jpg?fit=crop&amp;crop=faces%2Centropy&amp;arh=2&amp;w=216&amp;s=6ce7ae1fab4addb19b36ac4b7b4add65', 'width': 216, 'height': 113}, {'url': 'https://i.redditmedia.com/T1v9EE6xysmzarwBVXvG0BRvak6WuExgedi3fA6a3lc.jpg?fit=crop&amp;crop=faces%2Centropy&amp;arh=2&amp;w=320&amp;s=e37a8b340bc4668609fdea637373cbfb', 'width': 320, 'height': 168}, {'url': 'https://i.redditmedia.com/T1v9EE6xysmzarwBVXvG0BRvak6WuExgedi3fA6a3lc.jpg?fit=crop&amp;crop=faces%2Centropy&amp;arh=2&amp;w=640&amp;s=7f037f67af8ca721e8a259b64b15db2d', 'width': 640, 'height': 336}, {'url': 'https://i.redditmedia.com/T1v9EE6xysmzarwBVXvG0BRvak6WuExgedi3fA6a3lc.jpg?fit=crop&amp;crop=faces%2Centropy&amp;arh=2&amp;w=960&amp;s=c4bf25d41125c3cfde70e728cd652e51', 'width': 960, 'height': 504}, {'url': 'https://i.redditmedia.com/T1v9EE6xysmzarwBVXvG0BRvak6WuExgedi3fA6a3lc.jpg?fit=crop&amp;crop=faces%2Centropy&amp;arh=2&amp;w=1080&amp;s=4525e1edb8933fec42345e9f72fc5e8c', 'width': 1080, 'height': 567}], 'variants': {}, 'id': 'ehztwUmM7leX3TJ4380E7srRQIqITqoHmpX__TT43k8'}], 'enabled': False}",6,False,,,False,47,,{},,,True,False,False,boardgames,t5_2qmjp,r/boardgames,887575,public,,https://b.thumbs.redditmedia.com/bBrbTge2xyjJ2oxUhDMDwvvaRjMrjXynheaHVy1TRYM.jpg,73.0,140.0,Several digital boardgames are offered on Humble Bundle,47,https://www.humblebundle.com/games/digital-tabletop-bundle,[],,False,all_ads,6
,,False,AutoModerator,,#d0fffd,,"[{'e': 'text', 't': '🤖'}]",326005ee-9cf2-11e8-8b1f-0e8f9a199476,🤖,dark,richtext,t2_6l4z3,,,False,False,,False,,False,1535494333.0,1535465533.0,,,moderator,self.boardgames,0,False,0,False,False,9az95p,False,False,False,False,True,False,,,,[],,,dark,text,False,,{},False,,,,[],t3_9az95p,True,94,0,,False,all_ads,/r/boardgames/comments/9az95p/twoplayer_twosday_august_28_2018/,False,,,6,False,,,False,74,,{},"Chime in here, your weekly place for all things two-player! Sessions, strategy, game recs, criticisms, it all flies here.
","&lt;!-- SC_OFF --&gt;&lt;div class=""md""&gt;&lt;p&gt;Chime in here, your weekly place for all things two-player! Sessions, strategy, game recs, criticisms, it all flies here.&lt;/p&gt;
&lt;/div&gt;&lt;!-- SC_ON --&gt;",False,False,False,boardgames,t5_2qmjp,r/boardgames,887575,public,,self,,,"Two-player Twosday - (August 28, 2018)",74,https://www.reddit.com/r/boardgames/comments/9az95p/twoplayer_twosday_august_28_2018/,[],,False,all_ads,6
,,False,LonoXIII,,,,[],,,,text,t2_11jx7x,,,False,False,,False,,False,1535491848.0,1535463048.0,,,,popcultureuncovered.com,0,False,0,False,False,9ayxko,False,False,False,False,False,False,,,,[],,,dark,text,False,,{},False,,,,[],t3_9ayxko,False,57,0,,False,all_ads,/r/boardgames/comments/9ayxko/some_favorite_travel_games_given_limited/,False,link,"{'images': [{'source': {'url': 'https://i.redditmedia.com/iBDHOlKhia38g-erLvf1-oeC6g7gPTfuq3lfjAJ9mnM.jpg?s=71f3da00a6ff290787702838d8672cd0', 'width': 672, 'height': 372}, 'resolutions': [{'url': 'https://i.redditmedia.com/iBDHOlKhia38g-erLvf1-oeC6g7gPTfuq3lfjAJ9mnM.jpg?fit=crop&amp;crop=faces%2Centropy&amp;arh=2&amp;w=108&amp;s=3d97526ca8a4762a773d3ed7463d60fd', 'width': 108, 'height': 59}, {'url': 'https://i.redditmedia.com/iBDHOlKhia38g-erLvf1-oeC6g7gPTfuq3lfjAJ9mnM.jpg?fit=crop&amp;crop=faces%2Centropy&amp;arh=2&amp;w=216&amp;s=c606f49fec785b9b558f9e61db0fc551', 'width': 216, 'height': 119}, {'url': 'https://i.redditmedia.com/iBDHOlKhia38g-erLvf1-oeC6g7gPTfuq3lfjAJ9mnM.jpg?fit=crop&amp;crop=faces%2Centropy&amp;arh=2&amp;w=320&amp;s=dec0b3da0539a5d2b16adb30f41035e1', 'width': 320, 'height': 177}, {'url': 'https://i.redditmedia.com/iBDHOlKhia38g-erLvf1-oeC6g7gPTfuq3lfjAJ9mnM.jpg?fit=crop&amp;crop=faces%2Centropy&amp;arh=2&amp;w=640&amp;s=b55b4f4189b74d81f6218451263e7521', 'width': 640, 'height': 354}], 'variants': {}, 'id': '6Q8MPCEu4HKf112pnLyJULDzHt7YSi4Z__glHKCveJU'}], 'enabled': False}",6,False,,,False,70,,{},,,True,False,False,boardgames,t5_2qmjp,r/boardgames,887575,public,,https://b.thumbs.redditmedia.com/CZOcAIQJjFUYpg5Qgj1LjW4jIDriIRcLrmYuSrbcz1o.jpg,77.0,140.0,Some Favorite Travel Games (given limited time/space) - What are yours?,70,https://popcultureuncovered.com/2018/08/28/tabletop-tuesday-favorite-travel-games/,[],,False,all_ads,6
